id,text,obfuscatedText,sentiment,epsilon,mechanism
6509,just dont know why fortnitegame doesnt seem to care about asia servers the mostthey care for every single server region yet not asiappl from south east asia are having such bad pingfighting japanese with 0 ping while epic just fucks with this new,Fortnite irl,Negative,25,ContextualMhl
6540,happy birthday fortnite,"Happy birthday, Kai! I’d catch a grenade for ya. @ItsKaiLanger https://t.co/OyQaIAOu5a",Positive,25,ContextualMhl
6560,back at the og memes i love the sky base follow me every day cyper for everyday content,"IF YOU REALLY LOVED ME IT WOULD BE ""I LOVE YOU TO PLUTO AND BACK!"" Moon is so basic! cc: @nicomiz https://t.co/VyOIURHIMi",Irrelevant,25,ContextualMhl
6569,i havent watched the nba in quiet some time ive actually boycotted it most of the year because of the hong kong fiasco but dame_lillard may just bring me back its like he is on a fortnite heater,SCCCCCCCCCUUUUUURRRRRTTTTTTTED into 2018 like 🏎 🎤⤵️ See all the Abu Dhabi 🎆New Year's Eve 🎆adventures on #Xfinity https://t.co/jGPEwPytj8,Irrelevant,25,ContextualMhl
6583,this skin didnt age well localpolarbear,"Can you believe these dimples are 45 years old? Happy birthday, @MarioLopezExtra! https://t.co/LlF7JLaflD",Negative,25,ContextualMhl
6586,10 year olds trading on the stock market is scary news it can instill good financial habitscuriosity but equally high chances of it going the opposite way seeding gambling tendencies heavy losses from trading fos or worse this becoming the next blue whale not worth it,"This kid is cruising to be my favorite 10-year-old.

Watch the full video on @ellentube: https://t.co/yakmmJSvjH https://t.co/n2ZCV0lTw5",Irrelevant,25,ContextualMhl
6593,by far my best stream without a raid we were hovering around 1215 viewers for about an hour and gained a boat load of follows much love pictwittercomontb94ufaj,Katy's been streaming for 62 hours! Celebrate life with @drdancake pancake art and @JKCorden now:… https://t.co/0CgMOSW280,Irrelevant,25,ContextualMhl
6610,fortnitegame making the storm water was the most retarded thing anyone could come up with smfh its like yall wanna ruin ur own game,RT @mediaczar: Nerdiest - and most excellent - header animation: Conway's Game of Life on http://t.co/eEZ5ii2cxW http://t.co/0X4KOPn16U,Negative,25,ContextualMhl
6617,fortnite is bullying me arent theyi need him pictwittercom3q3yxuxkfy,Over 3 million people watched me learn how to play #Fortnite with @Ninja. So I livestreamed with him on Twitch. I g… https://t.co/ibS5YsV4hU,Negative,25,ContextualMhl
6619,lets stop using good popular songs for shitty fortnite montages please its just a disgrace to the song,@katystumblrr cuz I tried to do it the 1st time &amp; I didn't have any space so I deleted an app &amp; had to do it again &amp; then my fv song came on,Irrelevant,25,ContextualMhl
6640,my advice when you suck like me vmtiktokcomzmjfqkrpy,🌈 KISS MEH CAUSE I SPIT IN A TUBE AND IT TELLS ME I'M MORE THAN A WEE IRISH 🌈 23andme https://t.co/0Sbcznobnw,Irrelevant,25,ContextualMhl
6646,all the 14 yos shitting on me in fortnite catch me irl i swear ill rock yo shit,"I need a Mai Tai, so f*ckin' sci-fi
Give me the password, to the fuckin' WiFi. (OMFG THESE LYRICS/LEWKS &amp; VIDEO🚨IM… https://t.co/a7XGddT7d7",Irrelevant,25,ContextualMhl
6650,fortnite is running like ass fps drops everywhere wtf,Fortnite irl,Negative,25,ContextualMhl
6658,a man on top for that fortnite song,"What songs did you think of? Thanks for playing, Dominique and Wesley, but you got the boot. #GameofGames #KnockinBoots",Irrelevant,25,ContextualMhl
6675,roundedtiktak thank you pictwittercomzwqorfk0jn,@YearOnTwitter Thank you guys!,Irrelevant,25,ContextualMhl
6687,unpopular opinion fortnite is kind of the best game ive ever played its almost like it was thought up by a person who lives alone,"RT @DJWhooKid: got the best iPhone game ever called ""heads up with cristiano"" thanks @floydmayweather 4 recommending it get it here http ...",Positive,25,ContextualMhl
6694,not free to use recent work pictwittercomp9vmutkt49,Do you have your free copy of my latest app for Android & iPhone? What do you think of the exclusive photos? … http://t.co/wLQ1Jc6W,Negative,25,ContextualMhl
6715,fortnite has these bots that make the game unplayed lmfao literally unplayable because of course you land with just an axe and before you can loot a bot with weapons already on the ground just shoots you before you can even arm yourself lmfao fortnite right now is a waste of data,. @KatyActivities Making sure you guys get the most legit seats☝🏻F the bots.,Negative,25,ContextualMhl
6718,fuck fortnite yes i rage quit,Fortnite irl,Negative,25,ContextualMhl
6725,this guy is fucking cracked holeeee,Holey Roller. Holey $&amp;/@! https://t.co/fznheHK3Qa,Irrelevant,25,ContextualMhl
6750,rue its so beautiful pictwittercomorquudxmvj,Beautiful ✨✨✨ https://t.co/V5TtpX3RiY,Positive,25,ContextualMhl
6772,fuck i missed this,COME ON WE DONT HAVE TIME TO MISS THIS https://t.co/3ERvxQ29hd,Positive,25,ContextualMhl
6773,what the actual heck fortnite you clearly have enough money but you dick wds just dont learn the mistake thanks for ruining my weekend,"@nichegamer Actually, I stole it from my secret meme dealer #moneygang",Negative,25,ContextualMhl
6787,dumb lucky fortnite montage youtubepswjtnkbqbe via youtube,The lucky TOPwinners are now boarding to Rio de Janeiro to watch the big final. Have fun guys. http://t.co/G1KIPLSNgU http://t.co/icf55FCwOo,Irrelevant,25,ContextualMhl
6795,hi fortnitegame i get that you wont remove sbmm in pub games thats okay but why the fuck do you insist on putting absolute shitters on my team wtf,@katystumblrr cuz I tried to do it the 1st time &amp; I didn't have any space so I deleted an app &amp; had to do it again &amp; then my fv song came on,Negative,25,ContextualMhl
6806,johnson johnson stopped their trial because a participant got an unexplained illness the ft tweet needs commas jnjnews,RT @jheartsjaclyn: stop I’m gonna have a sister stroke @jamescharles @KimKardashian https://t.co/JTOiRN1PPG,Neutral,25,ContextualMhl
6826,johnson johnson stops selling talcbased baby powder in us and canada standasideusjohnsonjohnso,"RT @kkwbeauty: FREAKY, BIG BANK, NEW DRIP, FLASHY, BANDS, EXTRA, GLASS
The #FlashingLights Pressed Powders come in 7 prismatic and jewel-to…",Neutral,25,ContextualMhl
6838,washington us pharmaceutical company johnson johnson said monday it had paused its covid19 vaccine trial because one of its participants had become sickwe tamilnaduchroniclecomjohnsonjohnso,"RT @ABC: ""I don't want prayers. I don't want thoughts. I want gun control.""

Susan Orfanos says her son, Telemachus Orfanos, survived last…",Neutral,25,ContextualMhl
6850,a san diego superior court judge ordered johnson johnson to pay 34399 million for hiding the dangers and risks of its surgical mesh product for women onnbc7comzll0biq,"RT @skims: Real women, real stories: Alice Marie Johnson wears the Sculpting Bodysuit Mid Thigh ($68 in sizes XXS - 5XL) in Onyx. #ShowYour…",Neutral,25,ContextualMhl
6851,skunkworks at johnson johnson is rushing to develop a coronavirus vaccine inquirercombusinessdrugs via phillyinquirer,"If Tesla can help people in California wildfire, please let us know. Model S &amp; X have hospital grade HEPA filters.… https://t.co/KJgRBaKysz",Neutral,25,ContextualMhl
6853,adrian thomas the vice president of the scandalridden medical and pharmaceutical giant johnson johnson rounded off the group thomas is responsible for pandemic care at jj including the development of vaccines against ebola dengue and hiv and there was also martin,"RT @ABC: ""I don't want prayers. I don't want thoughts. I want gun control.""

Susan Orfanos says her son, Telemachus Orfanos, survived last…",Neutral,25,ContextualMhl
6854,coronavirus vaccine race gets desperate johnson johnson posts losses cases spike websfavouritescomscienceandte,"RT @ABC: ""I don't want prayers. I don't want thoughts. I want gun control.""

Susan Orfanos says her son, Telemachus Orfanos, survived last…",Neutral,25,ContextualMhl
6860,that johnson johnson leave in conditioner works good asf it really defined my babys hair,My heavenly baby! Showing off the new pink shadows in the Flashy Lights Collection wearing Flashy and High Key avai… https://t.co/W56daCGhNf,Positive,25,ContextualMhl
6877,with johnson johnson baby powder still being available in some markets we want to alert you of the damages that these talcbased products may cause learn more about jjs lawsuit bitly3gnsdna,"RT @kkwbeauty: FREAKY, BIG BANK, NEW DRIP, FLASHY, BANDS, EXTRA, GLASS
The #FlashingLights Pressed Powders come in 7 prismatic and jewel-to…",Negative,25,ContextualMhl
6889,johnson johnson pauses covid19 vaccine trial over patient exhibiting an unexplained illness twittercomievents13158,"RT @ABC: ""I don't want prayers. I don't want thoughts. I want gun control.""

Susan Orfanos says her son, Telemachus Orfanos, survived last…",Neutral,25,ContextualMhl
6890,they had a lawsuit over the opiates and the baby powder scandal why would they trust jj,RT @jimmykimmel: Which sister is most likely to sue @KimKardashian? NEW Three Ridiculous Questions! #3RQ @Ciroc https://t.co/Us7XUe6nOl,Negative,25,ContextualMhl
6891,fuck,"I need a Mai Tai, so f*ckin' sci-fi
Give me the password, to the fuckin' WiFi. (OMFG THESE LYRICS/LEWKS &amp; VIDEO🚨IM… https://t.co/a7XGddT7d7",Negative,25,ContextualMhl
6894,extraordinary podcast about deanna bergs fight against bilateral ovarian her determination to hold johnson johnson to account over its negligence in selling talcbased baby powder witnesspodcastscomshowsverified,"RT @kkwbeauty: Emma Powell wearing #UltralightBeams Loose Powder &amp; Gloss in Iridescent, a shimmering opalescent pearl. Shop the 3 new shade…",Negative,25,ContextualMhl
6896,johnson johnson regains footing analysis 15042020 johnson johnsons stock returned higher with a 448 profit with support from the 50day dlvritrtqqdp,"It’s Day 3 of #12days, and as you can see, @JohnKrasinski lost a bet. Enter to win today’s gifts on @ellentube!… https://t.co/hwm6Czpemw",Positive,25,ContextualMhl
6906,these niggers are people toojohnson johnson,"Hanging with my Habibi's, follow my bb's rubyrankin thealekovski cydney_moore https://t.co/1aCie2GBoY",Negative,25,ContextualMhl
6907,johnson johnson beats q1 estimates raises dividendjohnson johnson jnj stock rose 47 as of 1230 pm et today investors are optimistic about the companys strong firstquarter results and a dividend hike marketrealistcom202004johnso,"RT @skims: Real women, real stories: Alice Marie Johnson wears the Sculpting Bodysuit Mid Thigh ($68 in sizes XXS - 5XL) in Onyx. #ShowYour…",Positive,25,ContextualMhl
6917,big nyoos numewous gweat companies awe seeing fantastic wesuwts fda must myove quickwy rawr twittercomnytimesstatus,"RT @kkwbeauty: FREAKY, BIG BANK, NEW DRIP, FLASHY, BANDS, EXTRA, GLASS
The #FlashingLights Pressed Powders come in 7 prismatic and jewel-to…",Negative,25,ContextualMhl
6949,realdonaldtrump your plans to rush a vaccine out are fucked now buddy,RT @parsaghaffari: We have some big news to share – after weeks of work @_aylien we've managed to model @realDonaldTrump with a yuuge accur…,Irrelevant,25,ContextualMhl
6953,sales decline in us canada due to cancer claims so the company decides to victimize people in the third world,"As climate change reshapes the World’s coastlines, rich people lose their second homes. Poor people lose their only homes.",Negative,25,ContextualMhl
6960,johnson johnson to stop selling talc baby powder in us and canada jmp3e1ytdv reuters,"RT @kkwbeauty: FREAKY, BIG BANK, NEW DRIP, FLASHY, BANDS, EXTRA, GLASS
The #FlashingLights Pressed Powders come in 7 prismatic and jewel-to…",Neutral,25,ContextualMhl
6961,transvaginal mesh johnson johnson fined 344m for deceptive marketing to womentheguardiancombusiness2020,"RT @skims: Real women, real stories: Alice Marie Johnson wears the Sculpting Bodysuit Mid Thigh ($68 in sizes XXS - 5XL) in Onyx. #ShowYour…",Neutral,25,ContextualMhl
6964,and the us wants to trust this company with a vaccinejohnson johnson knew for decades that asbestos lurked in some of its baby powder nbcnewscomhealthhealth,"RT @ABC: ""I don't want prayers. I don't want thoughts. I want gun control.""

Susan Orfanos says her son, Telemachus Orfanos, survived last…",Negative,25,ContextualMhl
6977,johnson johnson ends baby powder sales in us canada after lawsuits posit links to cancer but will keep selling it elsewhere rt world news rtcomnews489146jo,"RT @kkwbeauty: FREAKY, BIG BANK, NEW DRIP, FLASHY, BANDS, EXTRA, GLASS
The #FlashingLights Pressed Powders come in 7 prismatic and jewel-to…",Neutral,25,ContextualMhl
6992,by combining product content can now be continuously optimized learn how johnson johnson drove 38 sales lift in beauty and 62 sales lift in otclearn more buffly3fcqupt,"RT @kkwbeauty: .@lializaaa wearing the soft, ultra-glittery #UltralightBeams Loose Powder in Peach, Lavender &amp; Bronze on her eyes and high-…",Positive,25,ContextualMhl
7004,covid19 vaccine big shock to corona vaccine johnson johnson stops all trials thekhabarbharatcomindiaenglish,"If Tesla can help people in California wildfire, please let us know. Model S &amp; X have hospital grade HEPA filters.… https://t.co/KJgRBaKysz",Neutral,25,ContextualMhl
7012,johnson johnson medical devices companies is honored to recognize the dedication of perioperative registered nurses join us to discuss resilience and stress management register here bitly37cgpab that changes everything,RT @voguemagazine: .@katyperry wore a glittery armband with the word “persist” etched across it at the #GRAMMYs. https://t.co/USndEp5FhW,Neutral,25,ContextualMhl
7019,lmaothis country is fvcked up jfc just saw a johnson johnson commercialyou know the folks with toxic talc causing cancertalking about how theyre working round the clock for a line up folks roll up your sleeves,America. What a country!  From Black hip-hop to Korean pop to a television commercial for Pistachios.,Negative,25,ContextualMhl
7021,new york charges johnson johnson with insurance fraud over opioid claimspageoneng20200917newjnj,".@KrisJenner gave me a cold. Worse than that, I now owe her 10% of my NyQuil. https://t.co/wZzZmDvJ19",Neutral,25,ContextualMhl
7023,johnsonjohnson to stop selling baby powder in usthe firm faces thousands of lawsuits that its talc products caused cancerit said in oct that its testing had found no asbestos in its baby powder after tests conducted by usfda discovered trace amountsbbccouknewsbusiness,"RT @kkwbeauty: FREAKY, BIG BANK, NEW DRIP, FLASHY, BANDS, EXTRA, GLASS
The #FlashingLights Pressed Powders come in 7 prismatic and jewel-to…",Neutral,25,ContextualMhl
7024,johnson johnson knowingly sold baby powder containing asbestos for decades and are now tasked with producing along with corporate criminals who received the 2nd largest fine in corporate history for their various crimes trust them,"RT @kkwbeauty: FREAKY, BIG BANK, NEW DRIP, FLASHY, BANDS, EXTRA, GLASS
The #FlashingLights Pressed Powders come in 7 prismatic and jewel-to…",Negative,25,ContextualMhl
7048,you mean the same johnson johnson that suppressed reports of asbestos contamination in their talc products for decades wonder how many died and birx says randomized controlled studies show no evidence of improved outcome with hcq liaryoutube77tmszubru4,"RT @ABC: ""I don't want prayers. I don't want thoughts. I want gun control.""

Susan Orfanos says her son, Telemachus Orfanos, survived last…",Negative,25,ContextualMhl
7065,zombies calling it now 2020 aint over fucking us,"RT @cher: WELL💋HERE WE GO AGAIN🤞🏻. WISH US ALL HEALTH💃🏻, HAPPINESS❤️,&amp; HOPE🕊 WE HAVE THE BEST YEAR EVER✨🌟✨.IF 2018 WAS AMAZING👑,I HOPE 2019…",Irrelevant,25,ContextualMhl
7069,johnsonjohnson paused all its trials related to covid19 vaccines because one of its volunteers developed an unexplained illnessthen this foh,"RT @ABC: ""I don't want prayers. I don't want thoughts. I want gun control.""

Susan Orfanos says her son, Telemachus Orfanos, survived last…",Neutral,25,ContextualMhl
7082,in 1982 johnson johnsons extra strength tylenol was recalled because seven people had died after taking it,"3,400: Americans who died by Terrorism since 2001

3,400: Americans who died by household Firearms since five weeks ago.",Negative,25,ContextualMhl
7094,johnson johnson covid19 vaccine study paused due to unexplained illness in participant statnewscom20201012joh,"RT @ABC: ""I don't want prayers. I don't want thoughts. I want gun control.""

Susan Orfanos says her son, Telemachus Orfanos, survived last…",Neutral,25,ContextualMhl
7099,it was all totally legal johnson johnson companies used a super poppy to make narcotics for popular opioid pills washingtonpostcomgraphics2020,"#WhenIWasYourAge We had candy cigarettes, gun-shaped cigarette lighters, and sucked flavored sugar through a straw.",Neutral,25,ContextualMhl
7100,big news numerous great companies are seeing fantastic results fda must move quickly twittercomnytimesstatus,RT @WhiteHouse: Share the news: Our manufacturers are adding jobs at the fastest pace since the 1990s. #MadeInAmerica http://t.co/bdhzFLfRCJ,Neutral,25,ContextualMhl
7108,johnson johnson is about to enter phase 3 trials of a covid vaccine that only works in one dose they claimremember how jj was found guilty of having cancer causing baby powderask yourself honestly do you trust these pharma companies i dont,"RT @ABC: ""I don't want prayers. I don't want thoughts. I want gun control.""

Susan Orfanos says her son, Telemachus Orfanos, survived last…",Negative,25,ContextualMhl
7182,this is dope puff is such a great kid,.@brckhmptn was here for the first time to perform “Sugar.” It was dope. Is that what the kids say? https://t.co/bh1HvdkGMu,Irrelevant,25,ContextualMhl
7205,iisirpootnickii computer having some issues may die at any point going to chance a steam anyway cant sign into steam so be playing some leagueoflegends while we keep trying to get on twitchtviisirpootnickii,@erikstorli No need to wait. It’s super easy to swap the HW2 and HW3 computers. Sensors are the same.,Neutral,25,ContextualMhl
7213,wtf,@wtfkates miss u bb,Negative,25,ContextualMhl
7249,ive never been this tierd in my entire life pictwittercompvi9sx4c7w,".@AlabamaHannah is on #TheBachelorette Recap Show playing ""Never Have I Ever."" https://t.co/8xnEUSlMWL",Negative,25,ContextualMhl
7251,super happy to work with wihsesports to make this opportunity happen for students,@nik0spapp @snsf_ch @nlpnoah @uwnlp @uwcse @UW Awesome! Congrats!,Irrelevant,25,ContextualMhl
7259,im excited to announce our partnership with volvicde the cooperation with volvic is an exclamation mark in german esport at the same time its an award for our success in leagueoflegends and the tremendous efforts of our team and staff behind the scenes thank you pictwittercomc6elixsdzk,"Today I proudly announce my new partnership with Sacoor Brothers, a portuguese clothing brand. http://t.co/ZMkxVArWKV http://t.co/e55ROVaJDQ",Neutral,25,ContextualMhl
7267,yuumi super cool fucking catbraum such a good personneeko damn funnyjanna she would take good care,.@SethRogen and @CharlizeAfrica have great chemistry. Almost as good as Charlize and her inner elbow. https://t.co/u8YmupMsPU,Positive,25,ContextualMhl
7272,my dopamine receptors have been fucked by league of legends i can no longer play a game unless its competitive and it feels bad,"If you're gonna watch #GameofGames tonight (and I know every single one of you will), make sure to download my ""Gam… https://t.co/8JIEBLNMj2",Negative,25,ContextualMhl
7281,this doesnt even make sense,@chrmanning Makes sense. Thanks for the insight!,Negative,25,ContextualMhl
7285,damn just want my 100lp back cant have shit in league of legends,Damn they could have shown Kanye &amp; I playing fast money and winning!!!!!!,Negative,25,ContextualMhl
7299,congratulations to our very own julienmid and value247 for being selected on team yassuo for the upcoming league of legends twitch rivals will value secure the threepeat will julien pick up his first championship find out next week twitchesports pictwittercompmbu3fiboj,"ZaZa is our favorite kid of Season 17, and it hasn’t even started yet. @official_tWitch https://t.co/6MNRjaBP8N",Irrelevant,25,ContextualMhl
7306,ingameleader is a social enterprise that uses esports to help atriskyouth get off the streets improve their mental health throw some love their way by following them,"RT @_aylien: In his spare time, our engineer built an experimental neural net in Rust and named it after a Dota 2 hero. Read about Juggerna…",Neutral,25,ContextualMhl
7342,this is the absolute funniest interaction ive ever seen on league of legends pictwittercomnswyumdvrx,I just witnessed the best funniest thing OF ALL TIME OMG @ArianaGrande 😂,Positive,25,ContextualMhl
7349,my games crew had a league of legends clash yesterday and this is how all of my texting apps looked likei love these assholes xd pictwittercomnt3cfslten,"If you're gonna watch #GameofGames tonight (and I know every single one of you will), make sure to download my ""Gam… https://t.co/8JIEBLNMj2",Positive,25,ContextualMhl
7357,bravo riotgames always know how to get me hyped for the leagueoflegends ranked season super excited,I'm ✈️✈️ to watch the best of 🇨🇳⚽️. Heard that football is booming there. Can't wait to see the brilliance. 👊… https://t.co/b10ZIHM2Ja,Positive,25,ContextualMhl
7365,check out my video captured by pictwittercomszd2mkyyty,"RT @katysprismlight: @katyperry my favourite moment in this video, realisation https://t.co/nsTTfK41S8",Neutral,25,ContextualMhl
7366,the implication that seraphine has witnessed jopping by superm and thus superm are officially part of league of legends lore i cant do this anymore only in 2020 would something as absurd as fucking jopping make it into the carefully constructed lore of a billion dollar game,.@official_tWitch makes the shopping cart dance look cool. @NakedJuice #FillYourCartForGood #ThanksSponsor https://t.co/RbGQAOgiW3,Negative,25,ContextualMhl
7382,check out my video captured by pictwittercomriqqq50yzf,"RT @katysprismlight: @katyperry my favourite moment in this video, realisation https://t.co/nsTTfK41S8",Neutral,25,ContextualMhl
7384,league of legends taught me to come to terms with my own disappointing third novel,I love a second chance... especially when it involves my game #TasteBuds and these hilarious teammates. #GameofGames https://t.co/QFzRUSSFsY,Positive,25,ContextualMhl
7393,no i like u motherfucker now kiss me,🌈 KISS MEH CAUSE I SPIT IN A TUBE AND IT TELLS ME I'M MORE THAN A WEE IRISH 🌈 23andme https://t.co/0Sbcznobnw,Positive,25,ContextualMhl
7406,i have just dreamed i was playing league of legends with korone and i was playing support shaco with a controllerit was so vivid,"I played #BurningQuestions with @JLo, and it turns out she loves @arod’s big… shoulders. https://t.co/aUGndJcm9N",Positive,25,ContextualMhl
7433,so good i had to share check out all the items im loving on poshmarkapp from shopangrykitty poshmk7zpktuisf9,"The perfect gifts for Valentines Day!
New Red Crème Lipsticks in Hot Sauce, Candy Apple &amp; Cherry Pop AND our… https://t.co/rymn2yYqzf",Neutral,25,ContextualMhl
7444,league of legends latest champion is a colorful pop star smartroboticscomng20201013lea,Proud!!! Champions of the world ⚽️ https://t.co/HpRRty01r2,Irrelevant,25,ContextualMhl
7445,wandakunpls sirhaian can i just say how fucking much i love videogames at this point i mean its soo insane how leagueoflegends just posts one picture of something we dont really know what it is and now we are trying to understand it and picking the pieces together d,"If you're gonna watch #GameofGames tonight (and I know every single one of you will), make sure to download my ""Gam… https://t.co/8JIEBLNMj2",Neutral,25,ContextualMhl
7446,my league of legends started having fps spikes two days ago is this a sign i should stop playing,"If you're gonna watch #GameofGames tonight (and I know every single one of you will), make sure to download my ""Gam… https://t.co/8JIEBLNMj2",Negative,25,ContextualMhl
7456,west had a bit of hope for a good playoff finish but its slowly dying with g2esports getting worse with every game at least na is getting a few wins,"RT @NBCGameOfGames: Hey West Coast, what can we say?

#GameofGames is coming for you NOW. ❤️ https://t.co/08JHC0fK0n",Neutral,25,ContextualMhl
7458,nothing like getting two leavers in the game that would have promoted you i love league of legends,"In @StarWars #TheForceAwakens, BB-8 is waaaaay cuter than R2D2.",Positive,25,ContextualMhl
7463,check out my video captured by pictwittercomx6kqew08hw,This is the autographed photo that @CRonaldoFever won. Do you like it? Get yours @mystarautograph http://t.co/ALHS3tPb http://t.co/yC6uTwcr,Neutral,25,ContextualMhl
7486,you have no idea how ready i am for this give me twisted fate,@katyxchristy don't get it twisted,Neutral,25,ContextualMhl
7506,dont forget tpci is partnering with tncent for a mobile pokemon league of legends and league being league aside tncent is a really shadyshitty company and will likely be featured,RT @TIME: Katy Perry prompts global scavenger hunt with a new song hidden in disco balls scattered around the world https://t.co/qTLRvxG5D7,Negative,25,ContextualMhl
7516,suikoden 21 alex kidd in miracle world persona 3 soul calibur 2 league of legends nier automata,Alex descends to Earth on a cloud after his (Rudolf-less) voyage with Santa. @Macys #ChristmasWindows. http://t.co/bMPYlz45FL,Neutral,25,ContextualMhl
