id,text,obfuscatedText,sentiment,epsilon,mechanism
10188,congratulations guys finally pubg unban ho gye thnks zakawaqar thnks all pubg lover,"@parsaghaffari @_aylien @MikeWallly congrats, guys! :D",Positive,25,ContextualMhl
10193,best squad yet instagramcompbobt_eaa4f,Squad https://t.co/RE1EDA1rAH,Irrelevant,25,ContextualMhl
10212,worst thing about banned is that all the players didnt knew this ban till the app shown error in playing as non of them is in social media nor watch any news,@katystumblrr cuz I tried to do it the 1st time &amp; I didn't have any space so I deleted an app &amp; had to do it again &amp; then my fv song came on,Irrelevant,25,ContextualMhl
10223,thank you waqar bhai finally pubg unbanned pictwittercompgeadhptnc,RT @scott_flute: #ChainedToTheRhythm #Chicago @katyperry It's soooo good!!!! You're unstoppable!!!!! 😍🎧⛓🎼🎵🎶 https://t.co/GZnUw2YsVW,Positive,25,ContextualMhl
10227,robodanjal any chance i could get a list of the maps for the new pubg tdm i cant seem to find a good list anywhere,RT @itsKELSEYtho: They put everything from Calabasas to great asses on the map 🔥 https://t.co/yqjdvrb60D,Negative,25,ContextualMhl
10249,i hate that music,"RT @alexcotss: @KimKardashian i usually hated sundays, but with #KUWTK i love them",Negative,25,ContextualMhl
10256,ptaofficialpk why u wanted to ban pubg is there any personnel fight with pubg corp pls unban this game if thousands of people requested u to ban this game then see now more than lakh people are requesting to unban dont take pubg as your pride problem,"If ComicCon people ruled the world, international conflicts would be resolved entirely by plastic  light saber fights in bars",Neutral,25,ContextualMhl
10262,xboxaimbotcom is the greatest site to get free modz,"Do you have my free app ""Cristiano Ronaldo""? I'm giving away a signed RM jersey to someone in the Top Users category. http://t.co/SlbvTKDu",Irrelevant,25,ContextualMhl
10268,doing anything in extreme will cause consequencesbanning pubg is not the solution,"Technically, alcohol is a solution",Positive,25,ContextualMhl
10271,this week in disruptive tech curated by rmnth 1 pubg ban a twist in the tale2 why facebooks politicalad ban is trying to tackle the wrong problem3 when law enforcement meets predictive algorithms foundingfuelcomcolumnthiswe,"NSA's anomaly/terrorist detector ridiculously optimistic, evaluated on unrepresentative population sample https://t.co/DcNSOuOpLj",Irrelevant,25,ContextualMhl
10275,pubg_support hiya so whenll u be fixing your fn console game been asking a lot and have been very satisfied with your lack of responses just wondering if lagouts are a part of the game like red zones and im just not aware or if you just cant fix a 2 year problem thx,RT @TIME: Katy Perry prompts global scavenger hunt with a new song hidden in disco balls scattered around the world https://t.co/qTLRvxG5D7,Negative,25,ContextualMhl
10280,amazing how the mainstream media tries to normalise muslim criminals and terrorists bdutt painted burhan wani as a facebook star son of a schoolmaster washingtonpost made baghdadi an austere scholar the print paints shahrukh as an aspiring model,"A millennium ago, Baghdad scholars adopted Zero, completing the system of ArabicNumerals used worldover, except in SuperBowls",Irrelevant,25,ContextualMhl
10306,on youtube pubg mobile best tiktok videos funny moments electro ice zard youtubecomwatchvv6erpx,"Some of my favorite new videos are on TikTok, so I came up with a fun new game to show them to you. https://t.co/AnmhUPaqK0",Irrelevant,25,ContextualMhl
10307,are u crazy gloating as if u r his fan n not a responsible journo sorry expected u change but drummer never change why dont u write a book u worshipper,NO BIG DEAL KENNY G IN MY LIVING ROOM!!! Happy Valentines Day 💋💋💋 https://t.co/A1GD0UlEwu,Irrelevant,25,ContextualMhl
10309,pta pubg ban is unconstitutional in nature because it violates article 18 of the constitution of the islamic republic of pakistan the employees involved should be suspended ptaofficialpk zakawaqar pictwittercompxh87dxb2z,WATCH: The Obama administration supports a ban on conversion therapy to protect America's youth. http://t.co/KO5EUFNZ6z,Irrelevant,25,ContextualMhl
10315,why can i hear my little sister arguing with people on pubg,I’m going to post some videos on my ig stories from the other night with all of my sister angels,Irrelevant,25,ContextualMhl
10334,i cant find confirmation anywhere but it looks like fenix_app has quit muting keywords if talon can strip the imaginary sports from my timeline i may need to switchblaseball like fandom pubg but at least the mute filters worked for pubg,I've followed two lucky fans on Sportlobster. Are you one of them? Download the app now and it might be you next time http://t.co/XmEbAuILOn,Irrelevant,25,ContextualMhl
10370,thatd be so sad tho,This is so sad https://t.co/mVaniAFnyt,Negative,25,ContextualMhl
10391,3 years ago this week such a good time for pubg and a huge accomplishment for playerunknown his team to put on the observer room was insane so many cables life changing thank you pictwittercom6rwnqks2kc,"A @Comic_Con State of Mind: ""#Cosmos: A SpaceTime Odyssey"".  Come with me… Pre-release footage &amp; Panel. Indigo Room, 6pm",Positive,25,ContextualMhl
10406,driving through new mexico is like driving through red dead redemption,"There’s a very large array of radio telescopes in New Mexico.  As seen in the film Contact. We call it the “Very Large Array""",Irrelevant,25,ContextualMhl
10412,red dead redemption 2 load timesxbox series x 38 secondsps5 1012 seconds yet again sony still have the better machine,Looking for a BluRay or DVD version of Cosmos?  It’s got 2hrs of extra stuff: http://t.co/Q1hf6X2Gyz,Irrelevant,25,ContextualMhl
10422,this is fantastic,Wow this is sooooo amazing!!!!!! Thank you for this!!!! https://t.co/Ge3qSmxnnA,Positive,25,ContextualMhl
10429,my favourite 4 gamesgod of warred dead redemption 2uncharted 1rise of the tomb raider,"In @StarWars #TheForceAwakens, BB-8 is waaaaay cuter than R2D2.",Positive,25,ContextualMhl
10439,red dead redemption 2 street fighter v cyberpunk 2077 resident evil 3 remake dying light 2 wnnrtxkg9n,"Rage, rage against the dying of the light https://t.co/aGRw4VowAQ",Neutral,25,ContextualMhl
10444,until jul 16 red dead redemption 2 is 3999 10 off amazonps4 amznto37yuuabx1 amznto2smbhgx,Classic Red bundle is SOLD OUT AGAIN!!! Shop our other available bundles NOW at https://t.co/PoBZ3bhjs8!,Neutral,25,ContextualMhl
10461,rock on mr black and keep being the most honorable cowboy in red dead redemption 2 brother cya next time pictwittercom0ieh2y86q4,"Happy #NationalSiblingsDay to this handsome soldier. Love, your favorite cowgirl. @vancedegeneres https://t.co/mKWey3M97V",Positive,25,ContextualMhl
10496,planning on spending my entire night playing red dead redemption and getting stoned and i have absolutely no regrets,"""There’s going to be one killer blues session in heaven tonight."" —President Obama on the passing of #BBKing http://t.co/GD2yY6vymV",Positive,25,ContextualMhl
10498,finally finished red dead redemption 2 after nearly a year and a half of play how does something so immersive with so much detail on such a grand scale even manage to get produced its nothing short of both an engineering and artistic miracle,Two years in the making. This makes my heart happy. https://t.co/SRywxUbTTi,Positive,25,ContextualMhl
10513,red dead redemption 2 xbox jogando no game pass mmixercomvaltinhoroberto,The lucky TOPwinners are now boarding to Rio de Janeiro to watch the big final. Have fun guys. http://t.co/G1KIPLSNgU http://t.co/icf55FCwOo,Neutral,25,ContextualMhl
10520,runs around aimlessly on red dead redemption 2 online completely forgetting shes supposed to be getting animals for the trader role,"FYI: In #Cosmos episode 2, those are real wolves that I really chase away with a real flaming torch — but my stubble is fake.",Neutral,25,ContextualMhl
10534,red dead redemption 2 pictwittercom2xblcpjlxl,"JUST POSTED: Zombie Apocalypse, pt 2: Everything you need to know.  @StarTalkRadio on iTunes &amp; http://t.co/C2e4xqiIuT",Neutral,25,ContextualMhl
10537,happy birthday red dead redemption that shit changed my life what a crazy experience,"Happy 40th birthday, @pommyrantz. You laugh like you are lit from the inside. It’s probably the tequila. https://t.co/bEcCBOpmfR",Positive,25,ContextualMhl
10544,hi guys i just got red dead redemption and i have no idea how anything works but a pack of wolves just killed me and stole my bear pelt so i rage quit and im gonna take a break from this game for the foreseeable future,"Maybe Wolves also love riding in cars &amp; hanging their heads out the window, but my sense is that they’d rather eat the driver",Negative,25,ContextualMhl
10555,gaming gone wrong fail compilation red dead redemption 2 csgo black ops 4 funny moments funnyfailsvideogaminggonewr,"SANTA'S GOT JOKES 🍪🥛🎅🏻🎄🎁 #CozyLittleChristmas 

https://t.co/LAdQo7Sdds

📹: Charlie Denis https://t.co/iiAuCvA4OA",Neutral,25,ContextualMhl
10558,red dead redemption 2 leaves xbox game pass on september 7if you havent bought it already highly recommend it pictwittercomms65gbzwml,Classic Red bundle is SOLD OUT AGAIN!!! Shop our other available bundles NOW at https://t.co/PoBZ3bhjs8!,Positive,25,ContextualMhl
10563,red dead redemption got me wanting to move to a mother fucking ranch,RT @itsKELSEYtho: They put everything from Calabasas to great asses on the map 🔥 https://t.co/yqjdvrb60D,Positive,25,ContextualMhl
10568,its been a year and a half since red dead redemption 2 came out and i finally have time to play it now it has completely sucked away 3 days of my life now very worth it,Two years in the making. This makes my heart happy. https://t.co/SRywxUbTTi,Positive,25,ContextualMhl
10585,red dead redemption 2 by simba pictwittercomoebblxui9l,"JUST POSTED: Zombie Apocalypse, pt 2: Everything you need to know.  @StarTalkRadio on iTunes &amp; http://t.co/C2e4xqiIuT",Neutral,25,ContextualMhl
10588,6th__man playing red dead redemptionoh shit a bear starts running me you cant out run a bear they run like 40mph him whatimmediately mauled by bear,"JUST POSTED @StarTalkRadio “Racing Extinction"" w/ @LeilaniMunter &amp; @eugenemirman on @iTunesPodcasts &amp; https://t.co/6BZlEf7tBS",Neutral,25,ContextualMhl
10589,i got the horses in the back red dead redemption 2 live at youtube9bvkh67oaei,JUST POSTED: @StarTalkRadio “StarTalk Live! at the Beacon [Pt 1]: Chasing Comets” On @itunespodcasts: https://t.co/NgyNTIqkF5,Neutral,25,ContextualMhl
10595,i won 5 achievements in red dead redemption 2 for 117 trueachievement pts trueachievementscomgameryoneko,"Four Golden Boots! Very happy and proud with this achievement. 
http://t.co/6IDvWxeMLA http://t.co/CVUauqa7om",Positive,25,ContextualMhl
10596,red dead redemption 2 youtubejoysfxh2r9o,"JUST POSTED: Zombie Apocalypse, pt 2: Everything you need to know.  @StarTalkRadio on iTunes &amp; http://t.co/C2e4xqiIuT",Neutral,25,ContextualMhl
10598,red dead redemption 2 online streamlabscomwarrenarroyoh,"JUST POSTED: Zombie Apocalypse, pt 2: Everything you need to know.  @StarTalkRadio on iTunes &amp; http://t.co/C2e4xqiIuT",Neutral,25,ContextualMhl
10601,the new red dead redemptions graphics look incredible,Classic Red bundle is SOLD OUT AGAIN!!! Shop our other available bundles NOW at https://t.co/PoBZ3bhjs8!,Positive,25,ContextualMhl
10602,red dead redemption 2 now live on twitchtvmarcel_kiefer,"RT @YouTube: 🔴  LIVE: Watch with the world, for the world. #OneLoveManchester on YouTube now ➡️ https://t.co/3xDT2kVDmR https://t.co/Xu6c3L…",Neutral,25,ContextualMhl
10644,had fun in red dead redemption tonight thanks all to who tuned in clipstwitchtvtsunderelightr,"If you watched #TheBachelorette last night, you got an eyeful. Now get an earful from my ""Bachelorette Recap Show""!… https://t.co/qPcQDxgQkL",Positive,25,ContextualMhl
10646,red dead redemption pictwittercomqnn6cnz5yq,Classic Red bundle is SOLD OUT AGAIN!!! Shop our other available bundles NOW at https://t.co/PoBZ3bhjs8!,Neutral,25,ContextualMhl
10670,red dead redemption 2 xbox one bitly2wc9cxm,Classic Red bundle is SOLD OUT AGAIN!!! Shop our other available bundles NOW at https://t.co/PoBZ3bhjs8!,Neutral,25,ContextualMhl
10679,dont understand why they port this instead of gtav on switch itll look much better,@martinengwicht @JoelSapp @rrosenbl @Tesla 21 TOPS for Xavier. Pegasus is just Xavier with a power hog GPU on a sep… https://t.co/BbRkHEiFAQ,Negative,25,ContextualMhl
10694,rockstargames i legit cant open or set my fucking camp im red dead redemption you need to let gta die and fix rdr2i it pisses me off the the games been out for a year and you havnt done shit,RT @DAChesterFrench: I don't play a lot of games but a friend just sent and this is pretty addictive: http://t.co/SLVX6kiF,Negative,25,ContextualMhl
10695,esports curiosities you probably didnt know about red dead redemption 2 goalsncom202002esport,The lucky TOPwinners are now boarding to Rio de Janeiro to watch the big final. Have fun guys. http://t.co/G1KIPLSNgU http://t.co/icf55FCwOo,Neutral,25,ContextualMhl
10708,im really sorry for you son its a hell of a thing arthur morgan being diagnosed with tuberculosis on red dead redemption 2,"RT @ABC: ""I don't want prayers. I don't want thoughts. I want gun control.""

Susan Orfanos says her son, Telemachus Orfanos, survived last…",Neutral,25,ContextualMhl
10712,red dead redemption 2 day 8 can i shoot micah i dont like micah twitchtvnightmarebearer,"@KatysPrismLight shot for 3 days in Utah, Directed by the incredibly talented Paul Gore. 📽",Negative,25,ContextualMhl
10719,red dead redemption 2 broke me broke my heart the wild west is a cruel place,RT @kpcollections: It's gonna be a wild one. 🌵 Go west in The Saguaro: https://t.co/GpqBqqGgEx https://t.co/x9R2wRQMvp,Negative,25,ContextualMhl
10722,thanks rockstargames youre rock stars pictwittercomztc25ucgrl,"RT @John_Wall: checked out the new iPhone game ""Heads Up with Cristiano"" and I can't put it down! its hot, check it out asap http://t.co ...",Positive,25,ContextualMhl
10729,im getting a lot out of red dead redemption 2 right now the game enables me to do a lot of dumb things and generally be an idiotfeelsgoodman,RT @DAChesterFrench: I don't play a lot of games but a friend just sent and this is pretty addictive: http://t.co/SLVX6kiF,Positive,25,ContextualMhl
10748,red dead redemption 2rockstargames pictwittercomqhk7znrwm8,"JUST POSTED: Zombie Apocalypse, pt 2: Everything you need to know.  @StarTalkRadio on iTunes &amp; http://t.co/C2e4xqiIuT",Neutral,25,ContextualMhl
10777,take a chance that love exists and do a loving act red dead redemption 2 giving life advice in the middle of a pandemic,"If you accumulate all the flora, fauna, and metal your true love gives you each day in the “Twelve Days of Christma… https://t.co/8VruwMrEsN",Neutral,25,ContextualMhl
10778,maybe the greatest musical moment in a video game ever,Here are some of the best #GameofThrones moments on my show to get you ready for Sunday. https://t.co/2GsWmSoaUd,Positive,25,ContextualMhl
10844,ghostrecon there has been a sound issue since the latest update when playing with friends you can hear their weapons when they are firing them just clicking sounds or no sounds at all please fix,In @StarWars #TheForceAwakens the TIE fighters made exactly the same sound in the vacuum of space as in planetary atmospheres,Negative,25,ContextualMhl
10849,wtf happened sjdkdks storeplaystationcom,Someone didn’t take her phone with her to the grocery store. @NetflixIsAJoke https://t.co/e0tquJFyKs,Neutral,25,ContextualMhl
10865,ghostrecon glad youre changing up the game to make it how it should have been on release spotted a typo on uplay though pictwittercomqw6dwvbegz,"Way to go, Brenna! You came, you confessed your love for Mrs. Butterworth, you conquered. See y’all next week! #GameofGames",Neutral,25,ContextualMhl
10888,had to go underground to get a double kill pictwittercomklrt7khdbg,RT @itzmero: @katyperry #ChainedToTheRhythm KILLED WITH SKIP https://t.co/C5LtNEHFnH,Negative,25,ContextualMhl
10889,welp s immersive update got delayed until later next month pictwittercomrqk5e2fe10,"Later today, we´re gonna release something really cool with my friends of MyStarAutograph. Keep posted!",Negative,25,ContextualMhl
10891,sometimes the melee just doesnt wanna go for some reason i swear i have had so many times where im like circling the guy and i just dont get a cqc melee to initiate youtubeec6g6_5tsks,Sometimes you gotta throw an elbow. @official_tWitch https://t.co/RzFIDCj5Mn,Negative,25,ContextualMhl
10906,the chopper shot is stunning,Just an FYI:  All beautiful photographs you've ever seen of the Super Moon were taken with a Super Telephoto lens.,Positive,25,ContextualMhl
10909,enough of this dlc bullshit just give us a new splinter cell video game,This new game is blanking ridiculous. https://t.co/sArAIXAkfP,Negative,25,ContextualMhl
10933,ghostrecon just took down a terminator pictwittercomqjrq9ic3be,"In @StarWars #TheForceAwakens, BB-8 is waaaaay cuter than R2D2.",Negative,25,ContextualMhl
10986,if only it was that simple if you read the comments most customers are complaining about how shady they are with information its tacky and disgusting to see especially when nothing fully good has came out wait dont mind waiting just let us know before we get our hopes up,@Cmdr_Hadfield @SpaceX @OurWorldInData Exactly. And many areas of countries showing good Internet actually have poo… https://t.co/XFpMcHBMHz,Negative,25,ContextualMhl
11006,ghostrecon so far playing the new update the stamina is pointless even on extreme if you have upgraded it and have a ration never runs out losing bullets on reload is pointless when you have like 300400 rounds sam fisher missions are buggy as hell good thing no gear level,"In @StarWars #TheForceAwakens, BB-8 is waaaaay cuter than R2D2.",Neutral,25,ContextualMhl
11020,this is how much i enjoy and i love the lore of both titles instagramcompb9feinlnn1u,These two are my new favorite dance duo. @TayeDiggs @official_tWitch https://t.co/YVcLZUSJuk,Positive,25,ContextualMhl
11028,trippy storeplaystationcom,RT @Krystan_Brooks: Nothing but net here at @katyperry pop up store. Great merch to WITNESS!! Come play with us #swishswish  #kpwww https:/…,Neutral,25,ContextualMhl
11033,while its true that needs a lot of support and fixes they definitely nailed the atmosphere and ambiance some of these vistas are just incredible heres hoping march 24th brings the changes the game needs pictwittercommghag6dlem,The Holiday Spectacular drops December 12th! That’s not the only thing that’s gonna drop. #GameofGames https://t.co/ZGXbcQ61F9,Neutral,25,ContextualMhl
11046,am i the only one experiencing so many bug with ghostrecon,Remember when I posted a video of me in a field and an orb was in it. That was taken at this shoot. Let me go find the video...,Negative,25,ContextualMhl
11086,ghostrecon ghostrecon_uk your pvp server doesnt work nobody can connect and pls delete the scope for drones theyre useless und block syringes pictwittercomqktnee6dvz,"RT @Vevo_UK: 👀👀 We've found one of @katyperry's disco balls in Leicester Square, London. Tune is a BANGER! #ChainedToTheRhythm https://t.co…",Negative,25,ContextualMhl
11106,see this the mess im talking about smh tryna play before i head into work ugh now i gotta wait instagramcompcfkowbifdrv,Facebook and Instagram are down! Don’t worry. I made this great playlist for you to watch on @ellentube. https://t.co/R9EUv23F7o,Positive,25,ContextualMhl
11107,like almost all the times ubisoft problem will we receive these rewards later too ubisoft,@KantadoAaveChe Multiple reward structures as in StarCraft or Dota 2 (eg rewards for killing enemies vs winning the… https://t.co/HV35xkEQQG,Negative,25,ContextualMhl
11149,ghostrecon please fix the mountain00016 error its been 3 hours already,@techreview Already fixed,Negative,25,ContextualMhl
11153,ghostrecon you telling lights are bulletproof on this game fix that shit yo,"A @Comic_Con State of Mind: If LightSabers are made of light, they would just pass through one another. Useless for defense.",Negative,25,ContextualMhl
11155,im getting some resident evil vibes from my characters original look pictwittercomlwlp9xapej,They all have different vibes so it depends on my mood! Loving Baddie right now https://t.co/jbPSxzT2Ws,Neutral,25,ContextualMhl
11175,gm fam hope you are all up and being great today jus wanted to take a second to thank all my followers for the support you guys are truly awesome,Thanks again to my fans for the support yesterday!! Catching up on some of my fan messages from the last few days.,Neutral,25,ContextualMhl
11214,shoutout to my brother coconutbrah for probably spending over 1000 hours in custom games with me by now,"Fun Fact: it took 7,000 packets of hot cocoa mix to make each tank. #GameofGames",Neutral,25,ContextualMhl
11229,solo q and this freak is spinning as fast as he can to lower the fps i thought they took this bs outrainbow6game,@martinengwicht @JoelSapp @rrosenbl @Tesla 21 TOPS for Xavier. Pegasus is just Xavier with a power hog GPU on a sep… https://t.co/BbRkHEiFAQ,Neutral,25,ContextualMhl
11240,hella excited for tonight as always ill be participating under aceofpyrites leadership and im looking forward to a terrific evening of if youre looking for some siege to watch swing by and say hello from 1900 bst twitchtvrainbowsix_uk,.@official_tWitch brought some of his Magic Mike friends to the show. @magicmikelive #ValentinesDay https://t.co/tISbXsnHAJ,Positive,25,ContextualMhl
11244,absolutely love my amazing sister who has made me this absolutely incredible bookmark pictwittercomwr604r9u5s,"RT @KylieJenner: Soo I did a collaboration with @kkwfragrance and i couldn’t be more excited, wow. I’ve fallen in love with my sisters frag…",Neutral,25,ContextualMhl
11248,rainbow6game spearheadbeer best combination for enjoying the proleagues before i head to montreal to see the finals live pictwittercomo5gx0vf2gz,The lucky TOPwinners are now boarding to Rio de Janeiro to watch the big final. Have fun guys. http://t.co/G1KIPLSNgU http://t.co/icf55FCwOo,Neutral,25,ContextualMhl
11269,5 years old and its in worse condition than black ice y1s1 was cant get operation health again ops might develop ms and get shackles instead the only game where the ground or the sky becomes the back of your head amiright rainbow6game,"In my asteroid-state-of-mind, I instead watched the 1998 film Deep Impact, where a Black president inherits a bad situation.",Negative,25,ContextualMhl
11277,ok im blocking this mans he is on a new level of being,"I saw a video of this guy dancing on the streets of Paris. Of course, I had him dance on my show. He blows my mind. https://t.co/FNJw6YVXsY",Irrelevant,25,ContextualMhl
11306,this man is so wholesome,He’s here and he’s perfect!,Positive,25,ContextualMhl
11311,time to show my love to a good streamer head on over to t_knockout_ s channel hes doing some right now show him some love,Show what you believe—get the #LoveIsLove tee. https://t.co/4uqGPAt4TZ https://t.co/FxaPN3Z36l,Neutral,25,ContextualMhl
11328,i have a brand new pc drivers are all up to date and all but game is still crashing what is going on rainbow6game,A Rainbow forms only broadside to your line of sight. That's why the pot of Gold at its base remains eternally out of reach.,Negative,25,ContextualMhl
11331,what a joke pictwittercomflxom0xvub,BEST joke of the year https://t.co/Z77g8WC9WC,Negative,25,ContextualMhl
11332,rocket league sea of thieves or rainbow six siege i love playing all three on stream but which is the best,"Citizens of Earth, get ready for the game of a lifetime. #GALAXY11 has the world's best, ready to defend our planet! http://t.co/UGu1KoDxx2",Positive,25,ContextualMhl
11363,where are hereford plane chalet and fortress in casual i miss the maps,"Low in the west, on this eve you'll find, a thin crescent Moon looking back, to the curtain of dusk the Sun has left behind.",Positive,25,ContextualMhl
11378,melusi 4k are you shocked justhoneybadger simmyster06 walkerpool mdassassin007 owahid65 pictwittercom0acuqjtvgl,"JustPOSTED StarTalk ""LiveAtTownHall"" @TheRealBuzz @iamjohnoliver [Part 2] @EugeneMirman iTunes &amp; http://t.co/8W0mDKuse0",Neutral,25,ContextualMhl
11382,gaming is my hobby and i love it like and follow if your in to th a same pictwittercomtnpzym9pvd,"@minliangtan @c4mer0n @burnflare @KroegerOve Btw, I like your gaming equipment",Positive,25,ContextualMhl
11388,im loving all the r6 and animal crossing crossovers somehow more surprising to me than animal crossing and doom,"In @StarWars #TheForceAwakens, BB-8 is waaaaay cuter than R2D2.",Positive,25,ContextualMhl
11403,i love rainbow6game so much,I love this game 😂😄❤️😉 https://t.co/6k3CElTIy1,Positive,25,ContextualMhl
11417,woooooo juice_ez just hit gold rank in nice job manstop by and check him out sometime,The lucky TOPwinners are now boarding to Rio de Janeiro to watch the big final. Have fun guys. http://t.co/G1KIPLSNgU http://t.co/icf55FCwOo,Neutral,25,ContextualMhl
11431,rainbow6game when will you ban mnkcronos players on console the game will die on psxbox because of that cheater,RT @KKHOfficial: Happy Kimiversary! We love hearing all your funny stories about how you’ve become addicted to the game 😂 https://t.co/XHMt…,Negative,25,ContextualMhl
11440,all most got that ace in ranked clutchwinpostsbreezier,Happy birthday to this Holy Roller ♥️ This badass birdie is so incredibly talented and the best is still yet to com… https://t.co/5BAtxAIH2D,Neutral,25,ContextualMhl
