id,text,obfuscatedText,sentiment,epsilon,mechanism
2573,this cricket has been the worst hivemind of fandom i have done this more times than i would love to be better if the tarzan level in kingdom hearts is as bad as borderlands,Nate and Landon are two kid geniuses destined to find each other and go to Disneyland. This video makes me so insan… https://t.co/5YLAQl44fM,Negative,25,ContextualMhl
2592,5 games 5 mutualspokémonborderlands p much allsims 4 havent played in forever thospiderman ps4spyro reigniteduuuh im not good at this eitherciaranstrange sasspiria orionsuccs msmarquise8bleh,"Citizens of Earth, get ready for the game of a lifetime. #GALAXY11 has the world's best, ready to defend our planet! http://t.co/UGu1KoDxx2",Neutral,25,ContextualMhl
2600,i want to thank for letting me run the new borderlands 3 dlc with him last night i had a lot of fun,What a fantastic @realmadrid team work with the win last night. #HalaMadrid http://t.co/ZaJsMAoqcf,Positive,25,ContextualMhl
2603,so after the past 9 days of streaming on the bounce and last nights insanely brilliant session on ive decided to take a couple of days off stream until thursday night where i will be trying out the new borderlands 3 dlc with sircuddlypantspsi out,Katy's been streaming around the ⏰ for 4 nights! Put your feet up and watch This is Everything with her on @YouTube… https://t.co/ovuNqCtpbs,Positive,25,ContextualMhl
2652,today sucked so its time to drink wine n play borderlands until the sun comes up so i can hate myself all day tomorrow,"ResistTheCarnage: Today’s “Blood” moon eclipse, if it’s any shade other than Black, will more likely be that of cream Sherry.",Positive,25,ContextualMhl
2653,shitting around borderlands 3 part 55 twitchtvslayer3000bot,".@official_tWitch and his family are so adorable, I sent them traveling around the country in an RV for a new digit… https://t.co/6JqSrIVlUW",Neutral,25,ContextualMhl
2671,april 30 until now for no apparent reason bl3 just cant connect to shift at all whats going on here ive submitted a ticket 2 days ago to gearbox but still no respond please help borderlands shiftstatus gearboxofficial,🎶🎉I can't wait to TANGO MY WANGO @ #WangoTango on May 13th! @1027kiisfm VIPs get your tickets 1st on 3/31 @ 10am… https://t.co/d2x4xYvLwH,Negative,25,ContextualMhl
2695,i wanna play shooty mclootyguns with more people borderlands 3 recently solod the maliwan takedown mission and torgues slaughterhouse 3000 on mayhem 3 was some of the most intense and fun fps gameplay ive had in years,"@KatysPrismLight shot for 3 days in Utah, Directed by the incredibly talented Paul Gore. 📽",Positive,25,ContextualMhl
2703,my sona as a vault hunter borderlands will always be my all time favorite game series pictwittercomtmn63snnje,"ZaZa is our favorite kid of Season 17, and it hasn’t even started yet. @official_tWitch https://t.co/6MNRjaBP8N",Positive,25,ContextualMhl
2709,hey why dont you get over here and come say hi playing some 2 and about overtwitchtvcblack47,"Oh, Steven, you came so far. At least you got to sing @BritneySpears and @TaylorSwift13 in front of all of America. #HotHands #GameofGames",Neutral,25,ContextualMhl
2713,stream on borderlands 3 tonight at 8pm come and say hi its always a pleasure to see on on the stream guys,"""When Knowledge Conquered Fear"" -  Ep 3 of Cosmos: A SpaceTme Odyssey premiers tonight 9pm on @FoxTV. Be there or be a sphere",Neutral,25,ContextualMhl
2734,surprise i still love jack pictwittercomhauwn4m4ps,Of course I still love you https://t.co/XNoLRKYnlc,Positive,25,ContextualMhl
2738,on borderlands two there is a fucking dragon someone help me,"In @StarWars #TheForceAwakens, BB-8 is waaaaay cuter than R2D2.",Neutral,25,ContextualMhl
2743,borderlands 3 is so good,@nichegamer BG2 was so good,Positive,25,ContextualMhl
2750,borderlands need help with my game for some reason my character is lagging no matter whose hose or solo and my game is up to date and its really frustrating any ideas would,"My katycats if u ❤️me &amp; represent the fandom pls know I only want to operate with kindness. Pls be kind to every1, even when it's difficult.",Negative,25,ContextualMhl
2751,congratulations to borderlands research institute for their recent grant in the amount of 80000 from pcqc bri is dedicated to the study of montezuma quail in the transpecos region in order to better understand its population projection pictwittercomjgjgybt4u1,"The plains of Africa, created on set at Santa Fe Studios, New Mexico. #WatchingCosmos http://t.co/zcXU5Kz7Q4",Irrelevant,25,ContextualMhl
2752,borderlands 3firebug bronzesabotage all statues for ember storeplaystationcom,RT @kkwbeauty: Ultralight Beams in Bronze by @Rebellebeautyx ✨ Shop now: https://t.co/JBPNXlKOWD https://t.co/DfnikzU9dM,Neutral,25,ContextualMhl
2769,i finally finished borderlands 3 its taken a while but im so proud of myself d now onto the guns love and tentacles dlc im so excited i love wainwright and hammerlock so much and they make a great couple so seeing them get married will be awesome,"If you accumulate all the flora, fauna, and metal your true love gives you each day in the “Twelve Days of Christma… https://t.co/8VruwMrEsN",Positive,25,ContextualMhl
2785,for more then 3 weeks now 2k uk hasnt drawn a winner for their borderlands 3 collector edition giveaway i mean i think thats funny that companies can just do fake giveaways and not be called out on it youtubecomwatchvhuh50,You could be a dancing elf for the 12 Days of Giveaways and win 12 Days! All you have to do is make a creative vide… https://t.co/x6NO6srHbK,Negative,25,ContextualMhl
2802,a bit late but i finally got master tier on my best hero redditj4otzm,RT @katieronaldo7: Happy Birthday to the best player in the world! You are my hero ❤️ @Cristiano http://t.co/sEG8UDW4NR,Positive,25,ContextualMhl
2808,the oga dota pit season 3 europecis looks like it is going to be one heck of a tournament with some of the best teams in europe competing in it afkgamingcomarticlesdota2,The lucky TOPwinners are now boarding to Rio de Janeiro to watch the big final. Have fun guys. http://t.co/G1KIPLSNgU http://t.co/icf55FCwOo,Neutral,25,ContextualMhl
2847,precovid student game day introducing students to robot entertainment game as our own form of leauge of legendsdota2 for our ell program they really loved it check it out ready set heroeslnkdingxjtnm,"G’day, Australia! I’m handing #GameOfGames over to @GrantDenyer. Don’t miss it this Sunday, 7:30PM! @GameOfGamesAU https://t.co/eDoeqmUDL2",Positive,25,ContextualMhl
2857,ugh i remember staring at lina and drooling for days and even made her just her my screensaver she looks so freaking good,"RT @kkwbeauty: Torin wears the shade Golden Ember from the new Sooo Fire Eyeshadow Palette and Gloss in Flammable. Get her look on Friday,…",Positive,25,ContextualMhl
2870,my friends are playing dota 2 and i cant understand shit but its entertaining as hell,@KantadoAaveChe Multiple reward structures as in StarCraft or Dota 2 (eg rewards for killing enemies vs winning the… https://t.co/HV35xkEQQG,Neutral,25,ContextualMhl
2897,dead game,"Ah, the ol’ spinning wheel of death. #GameofGames https://t.co/NE0nX1ksHy",Negative,25,ContextualMhl
2935,delete techies pls fck u dota2,"I need a Mai Tai, so f*ckin' sci-fi
Give me the password, to the fuckin' WiFi. (OMFG THESE LYRICS/LEWKS &amp; VIDEO🚨IM… https://t.co/a7XGddT7d7",Negative,25,ContextualMhl
2941,a truely masterpiece indeed 2018 may be the most exciting but this is the most emotionaloutstanding job to remark the end of an era in gaming history,"If you accumulate all the flora, fauna, and metal your true love gives you each day in the “Twelve Days of Christma… https://t.co/8VruwMrEsN",Neutral,25,ContextualMhl
2952,making crappy immortals til treasure 3 day 1 reddititorke,It’s Day 10 of #12Days. High time @SeanHayes showed up. https://t.co/i96qtFMufs https://t.co/GPfAo3S59e,Neutral,25,ContextualMhl
2962,guess ill broke,"@Erdayastronaut @somepitch Yeah, it might break",Positive,25,ContextualMhl
2981,what the fuck is wrong with u guysdota2,"I need a Mai Tai, so f*ckin' sci-fi
Give me the password, to the fuckin' WiFi. (OMFG THESE LYRICS/LEWKS &amp; VIDEO🚨IM… https://t.co/a7XGddT7d7",Negative,25,ContextualMhl
2994,crystallize99 became the top of eu mmr leaderboard congrats naviggenreadtext6,"@deetr44 Thanks!! RT: @Cristiano Congratulations on your victory Ronnie, and being top of the table",Neutral,25,ContextualMhl
3029,dota 2 making league of legends look good rn,"In @StarWars #TheForceAwakens, BB-8 is waaaaay cuter than R2D2.",Negative,25,ContextualMhl
3037,die with honor stfu and press ur bkb,bb ur a firewerk,Neutral,25,ContextualMhl
3039,say hello to sasha hostyn aka scarlett the current highestearning female esports player in the worldshe hails from canada and built her amazing career playing starcraft 2 and dota 2much respect to this amazing woman and role model onfirescarlett pictwittercomdm71v11cty,The second Topwinner who will fly to the Final in Rio is Anna Marcus. More games &amp; prizes: http://t.co/5GyKd3CIa1 http://t.co/7yFTfNqkzo,Neutral,25,ContextualMhl
3057,18th of aug 2020 happy birthday to these amazing players shackerlolzhandiateamdynamicslol teamastercn sccc_cnteam_unq pic credit riotgames starladderdota2 pictwittercomvzrvuvj57j,RT @katieronaldo7: Happy Birthday to the best player in the world! You are my hero ❤️ @Cristiano http://t.co/sEG8UDW4NR,Neutral,25,ContextualMhl
3058,37k to 32k i love dota 2 putang ina,"RT @_aylien: In his spare time, our engineer built an experimental neural net in Rust and named it after a Dota 2 hero. Read about Juggerna…",Positive,25,ContextualMhl
3061,pls guys stop im tired to give you more like of these,so tired I can't even fart 🆘💨,Irrelevant,25,ContextualMhl
3068,fuck my life,@wakingonperry my life is your meme ok ur welcome,Negative,25,ContextualMhl
3080,fucking finally,"I need a Mai Tai, so f*ckin' sci-fi
Give me the password, to the fuckin' WiFi. (OMFG THESE LYRICS/LEWKS &amp; VIDEO🚨IM… https://t.co/a7XGddT7d7",Positive,25,ContextualMhl
3083,i am dota 2 dota 2 i like happy casey,I love a second chance... especially when it involves my game #TasteBuds and these hilarious teammates. #GameofGames https://t.co/QFzRUSSFsY,Neutral,25,ContextualMhl
3084,kings,Jesus Is King ✨🙏🏼,Neutral,25,ContextualMhl
3095,and i cant even get a lvl 1 battle pass life is unfair,@carolineplz Seems fair,Negative,25,ContextualMhl
3108,wtf,@wtfkates miss u bb,Negative,25,ContextualMhl
3148,1000 wasted,Also 1000 times more fun!,Negative,25,ContextualMhl
3169,ti9 best plays epic moments the international 2019 dota 2 zonestreamcxti9bestplays,I'm ✈️✈️ to watch the best of 🇨🇳⚽️. Heard that football is booming there. Can't wait to see the brilliance. 👊… https://t.co/b10ZIHM2Ja,Neutral,25,ContextualMhl
3185,the professional dota 2 scene is fucking exploding and i completely welcome itget the garbage out,@KantadoAaveChe Multiple reward structures as in StarCraft or Dota 2 (eg rewards for killing enemies vs winning the… https://t.co/HV35xkEQQG,Positive,25,ContextualMhl
3204,donald trump jr china lied people died inside chinas death labs facebook facebookcomdonaldjtrumpjr,True story... @itsJulieBowen had been hiding in there for 3 days. @BlakeShelton https://t.co/VSiEY0bkUn,Neutral,25,ContextualMhl
3206,why would you fuck your way to the bottom exactly,Knee-slapping humor to a topologist: Question: Why did the chicken cross the Möbius Strip? Answer: To get to the same side.,Negative,25,ContextualMhl
3229,its nice not to have facebook anymore but i cant say i hate it when my cuz tells me the latest drama like how jeremy beuss skinny white ass tries to spout correct gender roles and anti abortionwomens health while he displays internalized homophobia and toxic masculinity,It turns out Brad Pitt and I have similar taste in women. https://t.co/rYP8JK4ayt,Neutral,25,ContextualMhl
3254,followed you dm and let me at least share on here facebook etc reggae is magical,"RT @Andreea7Ronaldo: @Cristiano You put some tweets with your favorite songs of the moment, to share music with us. #Celebrate15M",Irrelevant,25,ContextualMhl
3263,wow,"Wow! Reached the 30 million followers on Twitter, it’s amazing. Thanks everyone.",Positive,25,ContextualMhl
3277,all my success in the past came from people that dont know a single thing about me time to go back to that audience im done with facebook not catering to that crowd anymore,@katystumblrr cuz I tried to do it the 1st time &amp; I didn't have any space so I deleted an app &amp; had to do it again &amp; then my fv song came on,Negative,25,ContextualMhl
3286,leaked memo excoriates slapdash and haphazard response to global political manipulation dlvritrgbzjd,RT @TIME: Katy Perry prompts global scavenger hunt with a new song hidden in disco balls scattered around the world https://t.co/qTLRvxG5D7,Negative,25,ContextualMhl
3293,beverlycitizen ronald bellanti is a resident of beverly ma and works for ground control an organization he founded as a drunk driving prevention campaign he took to facebook to express deplorably racist and violent views please help expose him pictwittercom78ritukem2,"Yup. @SpaceX &amp; funky dance moves do go together. Parody of @BrunoMars. Yes, his name is Mars. [3m 30s] http://t.co/rDSS3MsCBl",Positive,25,ContextualMhl
3296,why do parents freak out so much when someone they dont know adds them on facebook,"I've repeatedly asked the media to respect the privacy of my baby son, who
has no public profile whatsoever; further... http://say.ly/aJEm3s",Irrelevant,25,ContextualMhl
3312,house democrats say facebook amazon alphabet apple enjoy monopoly power and recommend big changes cnbcx2gfvxq0,"RT @WhiteHouse: ""That's part of the power of the internet, making sure people don't feel alone on these issues"" —Obama #ObamaTownHall http:…",Neutral,25,ContextualMhl
3314,the ecommerce giant along with google apple and facebook are being investigated for potential violations of us antitrust law bitly3hrysxl,"Still disturbed that the popular URL shortener ""bitly"" turns its own address http://t.co/eXlXfacK into http://t.co/Sx1gKyOK",Negative,25,ContextualMhl
3316,this fat juicy son of a crackhead bitch my go to answer is always your mother,I LOVE MY MOM,Irrelevant,25,ContextualMhl
3329,whenever i feel a bit low the uncool clubs facebook group always manages to cheer me up what a wonderful group of humans if you wanna join feel free everyone is welcome facebookcomgroups6127272,You guys have no idea how much that call means to me!!!!! 112 is my favorite group! I literally almost cried! Kourt… https://t.co/RlCqFxs02h,Irrelevant,25,ContextualMhl
3331,facebook is a hub of fake information,"In this game, I try to guess if a news story is real or fake... or as you call it, scrolling through Facebook. https://t.co/1stTG00RfH",Negative,25,ContextualMhl
3353,praise and shame for facebook mockpaperscissorscom20200618pra,You asked: Congratulations on your 100 million Facebook likes! You deserve it! Can you PLEASE say Hi Serena??:) http://t.co/fepzUhEOy7,Neutral,25,ContextualMhl
3361,bro i had an abusive internet boyfriend that used to call me a stupid bitch whenever niggas used to like my pics on facebook and i used to beg him to not be mad at me i was such a stupid bitch for real,One time I heard a rumor that Mariah Carey used to have puppies backstage at her request to make her feel happy and… https://t.co/2AOQTf6GhM,Irrelevant,25,ContextualMhl
3402,another reason why qt is superior,@radiantjareau so qt,Irrelevant,25,ContextualMhl
3405,im so glad realtokyojetz made is alota yall aint even peep that was her going viral on facebook rapping in a car a few years back god is good,This whole flight back from Paris Kanye has been finishing up Teyana’s record OMG it’s soooo good!!!!,Irrelevant,25,ContextualMhl
3421,why does it have three versions wtf,Someone told me that the word Channel doesn’t really have three “n”s in it.  So I’ll re-post the Cosmos announcemen… https://t.co/sxYoN0Z00J,Negative,25,ContextualMhl
3426,woops made a bunch of boomer men mad on facebook lmfaoooo pictwittercom3yijbzv2fs,"Happy 40th birthday, @pommyrantz. You laugh like you are lit from the inside. It’s probably the tequila. https://t.co/bEcCBOpmfR",Neutral,25,ContextualMhl
3431,the best thing i couldve done for my was delete facebook,@katystumblrr cuz I tried to do it the 1st time &amp; I didn't have any space so I deleted an app &amp; had to do it again &amp; then my fv song came on,Negative,25,ContextualMhl
3449,in facebook jail for literally nothin they aint even tell me what got reported,.@JakeTapper will stop at nothing to give me the breaking news from backstage at my show. https://t.co/mne22KBztZ,Neutral,25,ContextualMhl
3456,me cant sleeprandom facebook article i didnt care about 5 hours ago how kylie jenner is dealing with trolls calling her uglyme,Who noticed Kylie always sings?! She has the cutest voice,Neutral,25,ContextualMhl
3463,someone just shared this on facebook and i had to come find the original because its a gem,"Eeny, meeny, miny, moe, catch a pearl and get some glow (before it's gone!)💄✨#KATYxCOVERGIRL https://t.co/GjGBwQEIas",Neutral,25,ContextualMhl
3469,i am very interested in this,@jorgecarcavallo I'm a bit short on time at the moment. I'm sure there are a lot of people that would be interested… https://t.co/iQNsYUOcHS,Positive,25,ContextualMhl
3487,some of my irls really think that george floyd did something wrong after a wrote a whole post on facebook about how black lives matter i dont wanna be friend with racist people i swear i didnt know theyre racist i feel bad for knowing them,"RT @ABC: ""I don't want prayers. I don't want thoughts. I want gun control.""

Susan Orfanos says her son, Telemachus Orfanos, survived last…",Neutral,25,ContextualMhl
3488,congratulations to all nominees including our leader amy hall for their award of excellence nomination the 37th annual is going virtual on facebook and youtube live this october 8th from 67pm to celebrate the fantastic work of our media community pictwittercom5wgcexrpay,RT @KUWTK: #KimKardashianWest been nominated for #TheSocialCelebrity of 2018 at this year’s E! #PCAs! You know what to do. 😉 https://t.co/H…,Neutral,25,ContextualMhl
3525,so glad i never joined facebook,You asked: Congratulations on your 100 million Facebook likes! You deserve it! Can you PLEASE say Hi Serena??:) http://t.co/fepzUhEOy7,Negative,25,ContextualMhl
3526,our ceremony is taking place this friday 29 may celebrating the outstanding best inspiring work staff students within have done this year streaming live 12 noon friday hisaperth facebook page pictwittercomre3iy9t66p,"Reminder: Amid the singing &amp; dancing &amp; speeches at @MTV's #VMAs, the actual award is an Astronaut planting a flag on the Moon",Neutral,25,ContextualMhl
3532,facebook employees reportedly feel guilty that the company didnt fix a known security risk fast enough to prevent its biggest data breach ever businessinsidercomfacebookemplo via businessinsider,"Facebook is building a Deep Blue for Go. 
https://t.co/54ciBHya4M #machinelearning",Neutral,25,ContextualMhl
3558,update chase emailed me from an anonymous email telling me a close friend showed him my facebook post that he didnt know he was doing this and asked me to take these down as if another outreach from a random email is not also creepy no im not taking it down,@kpezandchez i has a pepe file and many dank images and I has trolled v hard on y'all so don't think u just sendin out tweets to space...👋🏼,Neutral,25,ContextualMhl
3590,speakerpelosi this is very interesting,I was lucky enough to see @Cynthiaerivo in #TheColorPurple. That voice could swallow anyone whole. Amazing job… https://t.co/QiNGnzJxPT,Irrelevant,25,ContextualMhl
3602,miki21144689 have no one else but i have a brother who would be very happy about it so again nvid,@martinengwicht @JoelSapp @rrosenbl @Tesla 21 TOPS for Xavier. Pegasus is just Xavier with a power hog GPU on a sep… https://t.co/BbRkHEiFAQ,Irrelevant,25,ContextualMhl
3617,playing through the witcher 3 again and the novigrads quests and the atmosphere make me even more excited for the cyberpunkgame cant wait to get to the night city,That Cosmos Promo was fast.  But I feel another one coming.  The night is young.,Positive,25,ContextualMhl
3621,this is so upsetting,This is so sad https://t.co/mVaniAFnyt,Negative,25,ContextualMhl
3634,a delayed game is eventually good but a rushed game is forever bad shigeru miyamotovideo game design legenddevs of please take care of yourselves this is a game we have waited years for a few more weeks wont hurt,"The perennially hyped name ""Super Moon"" insults the legacy of Superman, Super Volcanoes, Supernovae, and even Super Mario.",Positive,25,ContextualMhl
3639,has been delayed againto pass the time why not grab an exciting is as if and had a babydark gritty sexy and full of action amazoncomgpawdb088gs,"Eeny, meeny, miny, moe, catch a pearl and get some glow (before it's gone!)💄✨#KATYxCOVERGIRL https://t.co/GjGBwQEIas",Neutral,25,ContextualMhl
3645,good morning it was so hot and gross last night i ended up pulling an all nighter go meon the plus made some good progress on my vindicator from silver linings n all pictwittercom1wcndhilco,"Thanks for witnessing on @YouTube. In case we don't see ya - good afternoon, good evening, and good night!… https://t.co/OkN2wRcVBO",Positive,25,ContextualMhl
3670,going through this right now great reporting by nightcitylifede,Laughing so hard right now.  https://t.co/RRpeCXRq3m,Positive,25,ContextualMhl
3671,everyone know the story of true lifelong friendship but not everyone knows how big chunk of your life is missing when those ends for some reason big thanks marykhln for filling that void with great vibes and conversations,"If you accumulate all the flora, fauna, and metal your true love gives you each day in the “Twelve Days of Christma… https://t.co/8VruwMrEsN",Irrelevant,25,ContextualMhl
3675,quality tweet,I never promised that all my tweets would be about the universe. But they are genuine thoughts that float around in my head.,Irrelevant,25,ContextualMhl
3683,cant wait to get it on next gen console d,"Interact with games via touchscreen, steering wheel buttons &amp; XBox/PS controllers",Positive,25,ContextualMhl
3720,cyberpunk 2077 outrage blows up cd projekt red devs dispute call out crunch story misinformation buffly3nw6z3p,".@FLAGALine answers who their first celeb crush was, their favorite CD growing up, and more #BurningQuestions! https://t.co/3LqKlWLXXv",Neutral,25,ContextualMhl
3723,very interesting read i agree more women should have careers in cybersecurity are women better at cybersecurity than men what a study showed about password security and more bitly3fdk96k,"This study says women who are funny at work are taken less seriously. Well, take this. @harto @brielarson https://t.co/r0Jxerf8cV",Irrelevant,25,ContextualMhl
3727,due for an upgrade from my gtx 1060 windforce and this would be great and needed to enjoy cyber punk 2077 with calebdorward,@martinengwicht @JoelSapp @rrosenbl @Tesla 21 TOPS for Xavier. Pegasus is just Xavier with a power hog GPU on a sep… https://t.co/BbRkHEiFAQ,Irrelevant,25,ContextualMhl
3729,twittercompcgamerstatus100 hour workweeks are pretty bad,"@alzslabyrinth @UberFacts In recent years, hours were much higher. Don’t recommend though — bad for health &amp; happin… https://t.co/qjvqHCR1cz",Irrelevant,25,ContextualMhl
3757,great wallpaper cyberpunkgame,"Hey guys, check out the new cool wallpapers on my website. http://t.co/MGroCC4ZQO ",Positive,25,ContextualMhl
3764,free cyberpunk 2077 stick bug over hereyoutubersht9rtahgg,"About a minute in, we flashed a teaser pic of Tesla cyberpunk truck https://t.co/hLsGsdyuGA",Neutral,25,ContextualMhl
3769,such a shame but knowing cd projeckt red and what they did when they delayed the witcher 3 itll be more than worth the wait,"Pre-order @RonaldoFilm with bonus content on DVD,Blu-ray or DigitalHD from Nov9 https://t.co/rsToTGtrgg #ronaldofilm https://t.co/wZC88CyJZd",Positive,25,ContextualMhl
3801,congrats to the team at idsoftware for winning game of the year,Congratulations to my winner Steven and my #GameofGames app winners! Now here’s something else new – a brand new ep… https://t.co/DxPevqSaY6,Irrelevant,25,ContextualMhl
3808,this game looks insane wtf,The Internet is insane,Positive,25,ContextualMhl
3838,dang there goes my birthday present but maybe this will be better,"Happy birthday, @SarahKSilverman. I think you make the world a better place. I know you make it a whole lot funnier.",Positive,25,ContextualMhl
3898,yaaaas i want to see keanu animated in anime,#KeanuReeves has an incredible talent for doing stunts. His signature on the other hand... https://t.co/8187fJpfdw,Positive,25,ContextualMhl
3912,ahh man i have zero friends ontwitter so i will tag secondyellowcrd a great guy and a great fm player,"Happy birthday, @LiamHemsworth. You are without a doubt one of my top three favorite Hemsworths.",Irrelevant,25,ContextualMhl
3918,god just let me customize my massive cock smh,RT @perryscrush: @katyperry This way you're seducing https://t.co/EfHTreX0k1,Neutral,25,ContextualMhl
3929,this looks kinda clean,This looks store bought 🤔 https://t.co/npS3Ut333g,Positive,25,ContextualMhl
3944,glad i got my strategy guide preordered i was going to do it last week but it was sold out so im glad it back in stock pictwittercomcrmoics3w2,Pre-order: Europe:http://t.co/RpIHzcbnH6 – U.S: http://t.co/R4b15VDN6Y,Positive,25,ContextualMhl
