id,text,obfuscatedText,sentiment,epsilon,mechanism
6,love speculative fiction a 100 in this via sffbookbonanza rafflecoptercomrafldisplaya,"Delighted to learn that @katyperry loves Space Aliens -- especially hot ones. (Not thermodynamically hot, just in appearance)",Neutral,25,ContextualMhl
12,amazon has the coolest shit i never thought i needed so i just purchased these hooks that attach to the passenger seat so that you can hang your purse im so excited,"Just Posted: @StarTalkRadio, Cosmic Queries Edition ""Grab Bag"" with cohost @chucknicecomic on iTunes &amp; http://t.co/18M4Y2bJXK",Positive,25,ContextualMhl
13,hated packing this one but at least it sold and arrived safelylol instagramcompcbbfx5rfqhw,Fast shipping!!! I know you will love them https://t.co/UNYLdHg8Af,Positive,25,ContextualMhl
18,amazon best sellers best sports collectibles ifttt32vpc7x 100 vintage football cards in old sealed wax packs perfect for new collectors ifttt2re9pfb ifttt2q5pvfw april 05 2020 at 1131am,"With next year’s @SuperBowl 50 the NFL abandons Roman Numerals, leaving @StarWars as the last bastion of this counting system",Positive,25,ContextualMhl
49,i played this interesting quiz on amazon try your luck for a chance to win exciting rewards amazoningamesharegvu,Someone shopping at https://t.co/54lIBKxf5i is gonna win a trip to one of my 12 Days of Giveaways! https://t.co/0FnCvb33LW,Neutral,25,ContextualMhl
80,1439 carats tcw 100 natural beautiful amethyst oval cabochon gem by dvg dvg amazoncomdpb07wg5qys7 via amazon,"KKW HEARTS BADDIE features notes of rose, iris, geranium, musks &amp; amber. Shop now at https://t.co/tbQezJs782 https://t.co/FicBxuZxZT",Neutral,25,ContextualMhl
96,seeing amazon prime marketing borat by getting him in tiktoks vlogs youtube videos is amazingworlds changing if you still doubt the power of an online audience its time to quit,"Some of my favorite new videos are on TikTok, so I came up with a fun new game to show them to you. https://t.co/AnmhUPaqK0",Positive,25,ContextualMhl
115,plague of corruption is on amazon and 3 on the ny times bestseller list pictwittercommr2gbn43i9,"Lots of media this week. For a change, just plugging the paperback release of Space Chronicles: http://t.co/oyG5m628yO",Negative,25,ContextualMhl
122,i didnt have massive success in but i am happy because i saw two reviews on amazon today and they made what has been a crappy week in my personal life a little better heres one detailed review you will find your audience pictwittercomysjleggy7w,"Lots of media this week. For a change, just plugging the paperback release of Space Chronicles: http://t.co/oyG5m628yO",Neutral,25,ContextualMhl
126,this dangerous party drug has been everywhere even on amazon nbcnewscomfeaturenbcou via nbcnews,"The category is Disco Fever! 🌟
The star is The Adora! 👠
Tune in, call in, buy in @qvc tonight at 9:00p ET I will be… https://t.co/I2eSIRMuh1",Neutral,25,ContextualMhl
127,great storytelling peppered with detail that brought the world to life make this easy to recommend amazon reviewer mybooktoclenchermill,best storyteller wins.,Neutral,25,ContextualMhl
134,i played this interesting quiz on amazon try your luck for a chance to win exciting rewards amazoningamesharegre,Someone shopping at https://t.co/54lIBKxf5i is gonna win a trip to one of my 12 Days of Giveaways! https://t.co/0FnCvb33LW,Neutral,25,ContextualMhl
157,played this interesting quiz on amazon try your luck for a chance to win exciting rewards amazoningameshareg4g,Someone shopping at https://t.co/54lIBKxf5i is gonna win a trip to one of my 12 Days of Giveaways! https://t.co/0FnCvb33LW,Neutral,25,ContextualMhl
159,plain janie smart janie shes the good sister that never causes any trouble meet her in janies secrets now jeanelia1964 available at amazon allauthorcomamazon45291,RT @jimmykimmel: Which sister is most likely to sue @KimKardashian? NEW Three Ridiculous Questions! #3RQ @Ciroc https://t.co/Us7XUe6nOl,Neutral,25,ContextualMhl
166,amazon hit from all sides as crisis highlights growing power thealexanewscomgadgetsamazon,Universe Busts-a-Move Sunday night: Harvest Moon. Totally Eclipsed. At its closest approach to Earth. http://t.co/NW05tnraMR,Negative,25,ContextualMhl
168,now 99 a notorious blockade runnera mysterious heiressan inconvenient secretthe trouble with misbehaving us buffly2onovp2 buffly2gsfjcw,RT @TIME: Katy Perry prompts global scavenger hunt with a new song hidden in disco balls scattered around the world https://t.co/qTLRvxG5D7,Neutral,25,ContextualMhl
171,aoc you make some very ignorant commentswhen you come to wi can we meet,.@_NC_Gentleman: But can I stand an egg on its end? // Sure. Any day of the year. If that's how you like to spend your time.,Irrelevant,25,ContextualMhl
201,across the fourwinds is the first book of the maidstone chronicles series the beginning of a wondrous journey amazon reviewer maidstonebooks smarturlitll9ggf,"Glad to be the cover of @DSECTIONMAGAZINE 5th anniversary book. ""THE JOURNEY"". https://t.co/G0xoSNHW0u",Neutral,25,ContextualMhl
215,yo lowkey i feel like amazon is always charging me random amounts for shit i didnt buy,Buy me something off my amazon prime list  https://t.co/EWenA4cq1F,Negative,25,ContextualMhl
218,a look into progress on the rivian and amazon codeveloped electric delivery vehicle youtubelkpoe8eulxm its kinda wild that alexa and tesla are becoming the most important car oss instead of android and ios,"Amazing work by Tesla Delivery teams, especially in Europe &amp; China! Most insane logistics challenge I’ve ever seen.… https://t.co/W72OBE5jpp",Positive,25,ContextualMhl
220,i played this interesting quiz on amazon try your luck for a chance to win exciting rewards amazoningameshareg4g,Someone shopping at https://t.co/54lIBKxf5i is gonna win a trip to one of my 12 Days of Giveaways! https://t.co/0FnCvb33LW,Neutral,25,ContextualMhl
279,nyxjacob thanks for entering grand summoners watch the video to see if you won a 100 amazon gift card retweet every day for another chance to winplay gs global now for a free 5 one punch man unit,"Do you have a great video for my game #EpicOrFail? Upload it to @ellentube, and you could win a $150 gift card!… https://t.co/M3JdyQiQwX",Neutral,25,ContextualMhl
287,dart against humanity ep 79 s5 e4 the new not normalapple itunesapplecomuspodcastdargoogle googlecompodcastsfeedgoogle play playgooglecommusiclistenspotify openspotifycomshow7oyfdhim6iheartradio iheartcompodcast256dapandora pandoracompodcastdartaamazon alexa,RT @TIME: Katy Perry prompts global scavenger hunt with a new song hidden in disco balls scattered around the world https://t.co/qTLRvxG5D7,Neutral,25,ContextualMhl
300,i like the idea behind this and whah it stands for but dont see this working,"@travis_frey @pyrrhical @Nafjan Hmm. Now I’m curious what ""idea” of mine you least agree with.",Negative,25,ContextualMhl
314,please explain how this is possible how can they let companies overcharge for this its a scam amazon shame on you pictwittercommqb7bupthx,"@mdekuijper @revue @F_Vaggi It seems it's Amazon Secure Web Gateway Service. If you follow me, I can DM you the err… https://t.co/3tZYq7PtlA",Negative,25,ContextualMhl
316,amazon stops accepting new online grocery customers as it cuts hours at whole foods stores dailymailcouknewsarticle8,"@johnny0129 We are still closing stores, just not as many as before. This basically splits the difference — about h… https://t.co/h1OTX4faVg",Neutral,25,ContextualMhl
319,awesome bonecakeswith strawberries and original maple syrup please bunniekat1962 octoberbones searcher9090 homenutt_1 skellyice deathslastlaugh cryptmidwest rjcrowtherjr 1carolinagirl figster017 lesliea10115 vampire4me madmmonstrosity,"KKW HEARTS BFF has base notes of vanilla marshmallow and cedar wood while opening with wild berries, pink rose peta… https://t.co/dLdTz6Orjb",Irrelevant,25,ContextualMhl
345,a bigram poem inspired by wileyed amazon personalize personalize can can now now use use 10x 10x more more item ed wiley,Artwork Personalization at Netflix: Cool blog post on how Netflix uses contextual bandits to personalize the artwor… https://t.co/7yeDoEARIn,Neutral,25,ContextualMhl
352,bbc news amazon boss jeff bezos rejects claims company acted like a drug dealer bbccouknewsavbusine,I’m having the PRIME of my life lilnasx jeffbezos #Nugget 👍🏻 amazon @ Old Town Road https://t.co/qjwvTPEyH1,Neutral,25,ContextualMhl
353,i played this interesting quiz on amazon try your luck for a chance to win exciting rewards amazoningamesharegs1,"It’s Day 3 of #12days, and as you can see, @JohnKrasinski lost a bet. Enter to win today’s gifts on @ellentube!… https://t.co/hwm6Czpemw",Neutral,25,ContextualMhl
354,you literally have fanboys all over the games industry who just cant wait to take cheap shots at microsoft xbox online services and features digital stores and the cloud are where things are headed google and amazon have tremendous reach to ignore the threat is dumb,"Interact with games via touchscreen, steering wheel buttons &amp; XBox/PS controllers",Positive,25,ContextualMhl
364,congratulations to ninamanning78 on publication day hope you have a fabulous day and that your book flies,Today is a special day: the launch of my  mom's book throughout Spain! https://t.co/gPHCBpfD2h,Irrelevant,25,ContextualMhl
394,one of the saddest days of my life queens business leader reflects on what could have been one year after amazon killed its hq2 project in lic qnscomstory202002,NYC getting a little cozier! Talk about shouting it from the rooftops! Thanks @AmazonMusic! 🎅🏻 https://t.co/AjZFq6nCoN,Negative,25,ContextualMhl
397,best sellerscreen cleaner kit best for led lcd tv1995amazoncomscreencleaner,Used Flashing Lights Big Bank 🏦 &amp; Nude Lipstick1 with Nude LipLiner 1 https://t.co/aIjp1MBlpZ https://t.co/wmfYlGe9zi,Positive,25,ContextualMhl
410,squadwipe turn n burn pictwittercomleg3gbd82j,"Turn it up, it's your favorite song! Album listening pajama party starts now, listen along with Katy here:… https://t.co/M08cjG8wQ3",Neutral,25,ContextualMhl
427,wow,"Wow! Reached the 30 million followers on Twitter, it’s amazing. Thanks everyone.",Positive,25,ContextualMhl
447,youre still not diamond yet pictwittercomjk37upyt1z,"Fun Fact- I was bribing North to wear her butter 350’s by saying they glow in the dark. However, she made me turn o… https://t.co/EkHNImtIGm",Neutral,25,ContextualMhl
452,woohoooo next comic is out these are getting so juicy youtuberteunyyvju0,Hi guys! Check out my animated show trailer and the comic book now! 👉 https://t.co/pq8lesrqYI 🔥 #FCBD… https://t.co/K6R9b2CBLu,Positive,25,ContextualMhl
465,feels good to get a victory in with your high school buddies we are all in our late 20s now victorpmeraz4 noldray deserved a second season,"2nd seasons a charm! BIG congrats to the talented, hardworking young man that is @TheLaineHardy. So glad u gave us… https://t.co/LiKMdHyJ9M",Positive,25,ContextualMhl
493,a zip a hop and a step and a bam youre dead sgh_rts slimmdizzyxo pictwittercomrygeja12dl,"I need a Mai Tai, so f*ckin' sci-fi
Give me the password, to the fuckin' WiFi. (OMFG THESE LYRICS/LEWKS &amp; VIDEO🚨IM… https://t.co/a7XGddT7d7",Neutral,25,ContextualMhl
507,the trailer is dropping in around an hour and 28 minutes cant wait playapex apex_intel pictwittercom0o1gpnya3d,The Official COSMOS Trailer. Re-posted [3m 20s]: http://t.co/GOs6gIeEZN,Positive,25,ContextualMhl
515,best game evermrjcorbs playapex pictwittercomexzbxe6ggk,This still might be my favorite game we’ve ever played. #TasteBuds @KristenBell @daxshepard https://t.co/Cl0LT39wP7,Positive,25,ContextualMhl
519,ummm wth pictwittercomexchrvg16o,Laughing so hard right now.  https://t.co/RRpeCXRq3m,Negative,25,ContextualMhl
524,happy birthday gautam,"Happy birthday, Mila Kunis! Sending love to you and the Kutch.",Irrelevant,25,ContextualMhl
526,umm playapex when i died it said bug this pictwittercombzmhzbadof,@bug_gwen  “Rock Flipping Day”?  How voyeuristic.  Can’t a bug get any privacy these days?,Neutral,25,ContextualMhl
531,first game of the day eventhough my damage is embarrassing pictwittercomyxta8wmctn,Check out yesterday's game photos  http://t.co/c8CjPGMZ,Neutral,25,ContextualMhl
533,communication is key we bust they ass,Ass-shaking astrophysics in Miami beach: [Video: 1m 15s] http://t.co/GwZAUV5GfH,Irrelevant,25,ContextualMhl
560,playapex servers are whack pictwittercoma1pzbn3jg7,RT @OnAirTJ: Okay this is nuts. There's a disco ball at Nathan Phillips Sq PLAYING BRAND NEW @KATYPERRY. Go check it out! #ChainedToTheRhyt…,Negative,25,ContextualMhl
568,playapex you got a bug when a game ranked is ended my friend get 10 min penality and he dont leave the game,@katystumblrr cuz I tried to do it the 1st time &amp; I didn't have any space so I deleted an app &amp; had to do it again &amp; then my fv song came on,Neutral,25,ContextualMhl
586,it was a good day in pictwittercomlz6b1oiptt,Here's another photo from yesterday. We had a great afternoon. http://t.co/6u6ixa5W,Positive,25,ContextualMhl
604,playapex respawn hey respawnjust now played the first quest for this seasonoh boy you did a great job on the story and the pve modecant wait for the next oneawesome work,"Thomas, Thomas, Thomas. 🙁That’s why you have to play #HotHands. The rest of you, go start practicing for Season 3!! #GameofGames",Positive,25,ContextualMhl
616,ending season 3 by stealing someone elses kill and eliminating the kill leader,You can catch up on season 2 of #SplittingUpTogether in the ABC app or on https://t.co/fITfXwumg3. Do it before the… https://t.co/JNGaGnf3FX,Neutral,25,ContextualMhl
620,im proud that i created this banner for scoobz___ __scoobz__ even though it takes me almost 1 day sigh need to work faster xd but im pretty impress with this work anyways twitchtvscoobz___ if you like apex legends content do help a streamer out,It turns out making @OctaviaSpencer and @official_tWitch dance like the dancers I put behind them is a lot of fun. https://t.co/UAs1VxuGVD,Neutral,25,ContextualMhl
638,wilson,I was as surprised as they were. It’s Owen Wilson’s birthday! https://t.co/hN8zg0d7YY,Irrelevant,25,ContextualMhl
645,alright lets do it the road to gold 2 is now apex ranked come hang twitchtvcpatran,The lucky TOPwinners are now boarding to Rio de Janeiro to watch the big final. Have fun guys. http://t.co/G1KIPLSNgU http://t.co/icf55FCwOo,Neutral,25,ContextualMhl
659,haha bet you by 4 points digitalnutter87 in ranked pictwittercomzprctbdtvt,I'm driven to perfection. Are you? Show how by posting a 15s video or pic tagged #CR7DrivenToPerfection. Learn more http://t.co/csJmFznT9Z,Neutral,25,ContextualMhl
664,after playing today im gonna just say itworlds edge is a better map than kings canyon playapex,RT @itsKELSEYtho: They put everything from Calabasas to great asses on the map 🔥 https://t.co/yqjdvrb60D,Positive,25,ContextualMhl
689,we need a third for ranked right now dm me,@mesch13 You have to follow me back for me to DM you.,Neutral,25,ContextualMhl
703,100 agree its also so tiresome to play on and boring to look at i hope when olympus comes they either rotate it out or we dont see it much,Congratulations to @TrevorNoah tonight. @TheDailyShow's new opening credits now show Earth rotating in the correct direction.,Neutral,25,ContextualMhl
706,im not gonna spend any more money on until they fix there shit its in a worse state then fortnite rn its dumb,Fortnite irl,Negative,25,ContextualMhl
710,bout to fuck around and stream playapex grind and brawlhalla afterwards mixercomshinobiszn,"RT @Vevo_UK: 👀👀 We've found one of @katyperry's disco balls in Leicester Square, London. Tune is a BANGER! #ChainedToTheRhythm https://t.co…",Neutral,25,ContextualMhl
712,playapex gh057ayame figure this rainbow6game is the most simple concept but an amazing game and still thriving after years of success you know why they only listen to the comp scene figure it out shit bags,A Rainbow forms only broadside to your line of sight. That's why the pot of Gold at its base remains eternally out of reach.,Negative,25,ContextualMhl
714,playapex i have problems to buy the battlepass with the new patch,"Want to #WITNESS more? The @Target edition comes w/ two bonus tracks: ""Dance With The Devil"" &amp; ""Act My Age""… https://t.co/n1tfHNI7HA",Negative,25,ContextualMhl
726,first we had code leaf and now we have the pleasure to present code shoe thx playapex pictwittercomgtabw18jhp,RT @TIME: Katy Perry prompts global scavenger hunt with a new song hidden in disco balls scattered around the world https://t.co/qTLRvxG5D7,Positive,25,ContextualMhl
739,watching lululuvely vids always hype me up letsa goo playapex,Now watching Relatively Nat &amp; Liv! I love seeing their fam!,Neutral,25,ContextualMhl
775,playapex can you guys please fix the disconnect reconnect issue it really sucks getting penalized in ranked for a disconnect and dying you need invincibility or something were you can get killed cuz its really bullshit,@katystumblrr cuz I tried to do it the 1st time &amp; I didn't have any space so I deleted an app &amp; had to do it again &amp; then my fv song came on,Negative,25,ContextualMhl
783,watch strapxaxholic on twitch i think im pretty good at twitchtvstrapxaxholic,I love to watch this man dance. @official_tWitch https://t.co/9DIpMmakV6,Neutral,25,ContextualMhl
790,respawn playapex check out we dont like your singing twitchtvvideos5636940,RT @TIME: Katy Perry prompts global scavenger hunt with a new song hidden in disco balls scattered around the world https://t.co/qTLRvxG5D7,Neutral,25,ContextualMhl
795,mixercomsirdover357ut,best. prezzy. ever. I will always love you too @dollyparton ❤️🧡💛💚💙💜🎂 @ Chuck E. Cheese’s https://t.co/vRQTCk09t8,Neutral,25,ContextualMhl
800,sd the best fps out was in love with but the toxic community and random operator nerfs based on players frustration levels lost me is dope too tho is cool pubg made about 100 mil and only added new landing controls gg,"RT @IanPavelko: Just got 48.12.1
Keep Climate On. Romance Mode. Pole Position. Emissions Testing. USB Game Controller support!
God I love t…",Positive,25,ContextualMhl
807,just finished assassins creed odyssey through shadow_official shadow_na from the beginning to the end thanks for the amazing gaming experience on your service,@loomborn @bobatl Yes. Ancient Greece - inferred from Earth’s shadow during Lunar Eclipses.  But it was lost to the Dark Ages,Positive,25,ContextualMhl
813,were gonna try to save some historical place with bad gameplay and poor decision making dont miss it in assassinscreed odysseynetwork by netgeargamingpowered by cyberpowerpcswag from themarvelfactoronly on watchmixer now at mixercomitsplanb,"""When Knowledge Conquered Fear"" -  Ep 3 of Cosmos: A SpaceTme Odyssey premiers tonight 9pm on @FoxTV. Be there or be a sphere",Neutral,25,ContextualMhl
818,update i actually finished odyssey i wish the threeponged questline structure was communicated a bit more clearly but that game is a lot of fun once it hits its stride twittercomiv_javystatus,"In #Interstellar: They reprise the matched-rotation docking maneuver from ""2001: A Space Odyssey,"" but they spin 100x faster.",Positive,25,ContextualMhl
829,the real path to valhalla is main story without side quests its so fuckin relieving,A Rainbow forms only broadside to your line of sight. That's why the pot of Gold at its base remains eternally out of reach.,Positive,25,ContextualMhl
832,old screencaps from assassins creed odyssey when i found the wonder woman armour for kassandra and this nightmare of a horse pictwittercom7shmvbgsv9,"RT @KKWMAFIA: GEMINI Available In 4 Colors. Pink, Neon Green, Black, &amp; Nude. Out on 07.10 @LemkeUs Drop2 https://t.co/WyjaCw8cVh",Neutral,25,ContextualMhl
833,finally completed assassins creed odyssey so now comes the best part of finishing anything reading the tvtropes page,"""When Knowledge Conquered Fear"" -  Ep 3 of Cosmos: A SpaceTme Odyssey premiers tonight 9pm on @FoxTV. Be there or be a sphere",Positive,25,ContextualMhl
855,i actually really liked assassins creed 1,"Choosing a LightSaber is like saying “Don’t need guns. I prefer a sword after waiting for my enemy to stand in front of me.""",Positive,25,ContextualMhl
861,thats the best one wtf,I just witnessed the best funniest thing OF ALL TIME OMG @ArianaGrande 😂,Positive,25,ContextualMhl
866,i was inspired by miserabletop to get assassins creed on switch and now i couldnt be more excited to leave the party early to go home and play black flag pictwittercomyhrybjdynn,"Tesla Sentry Mode will play Bach’s Toccata and Fugue during a robbery (and keep Summer safe)
https://t.co/wnS5qLeB2E",Positive,25,ContextualMhl
921,get ready for the weekend with our special offerswith marvel spider man assassins creed black flag call of duty infinite warfare and many others this weekvisit nzgameshopcomspecialoffers to get a great deal,I’m so excited for this weekend. #AvengersEndgame @taylorswift13 #GameofThrones https://t.co/OAZGT22rrD,Neutral,25,ContextualMhl
930,i love you guys,I love you pre internet.,Positive,25,ContextualMhl
953,still my favourite assassins creed games pictwittercom8japw7wrul,This still might be my favorite game we’ve ever played. #TasteBuds @KristenBell @daxshepard https://t.co/Cl0LT39wP7,Positive,25,ContextualMhl
970,its kind of incredible what games ill be getting this year for the xbox series x im gettingassassins creed valhallawatch dogs legiondirt 5fuserthe falconeerthanks to gamepassgears tacticsdestiny 2 beyond lightbefore xmascyberpunkthe medium,Alex &amp; his dog float in space above Jupiter &amp; Saturn. Joyriding with Santa in @Macys #ChristmasWindows http://t.co/dlhDJlFHaA,Positive,25,ContextualMhl
979,eivor can crush me with her thighs,".@FLAGALine answers who their first celeb crush was, their favorite CD growing up, and more #BurningQuestions! https://t.co/3LqKlWLXXv",Neutral,25,ContextualMhl
980,this is amazing,Wow this is sooooo amazing!!!!!! Thank you for this!!!! https://t.co/Ge3qSmxnnA,Positive,25,ContextualMhl
986,fuckkkkkk i cant wait,@ThorpeyNFFC can't wait,Positive,25,ContextualMhl
987,nice to bow youthis my creepypastaassassins creed oc i love this girl to peices i cant believe i havent posted a drawing of her on twitter time to fix that fyi this chacrter is a one reason i go by blademaster122 pictwittercombfknldpnxx,"Happy #NationalSiblingsDay to this handsome soldier. Love, your favorite cowgirl. @vancedegeneres https://t.co/mKWey3M97V",Positive,25,ContextualMhl
1023,my experience with assassins creed odysseywtf are those the opening credits ive been playing this for days wheres the spiderman disc,Congratulations to @TrevorNoah tonight. @TheDailyShow's new opening credits now show Earth rotating in the correct direction.,Negative,25,ContextualMhl
1032,assasins creed odyssey is good like really really good im shocked at how different this game is compared to early installments and very happy i purchased it,Happy that you like it. @jmjalil96 @Cristiano I tried your penalti game for ipod! It's really great!,Positive,25,ContextualMhl
1035,cant wait,WHAT WAIT OMG,Positive,25,ContextualMhl
1051,im in love mlssmahut ubisoft pictwittercomtbk2cnf1ou,"RT @KylieJenner: Soo I did a collaboration with @kkwfragrance and i couldn’t be more excited, wow. I’ve fallen in love with my sisters frag…",Positive,25,ContextualMhl
1069,_ gets bad flashback in movie theater realize the witcher was actually good,"After several Steven Segal films in a row, you'd think bad guys would know to avoid rooms that contain both him &amp; a PoolTable",Irrelevant,25,ContextualMhl
1070,shit time for a recast,"I hope it all goes well with Abidal, and that he gets back soon.",Negative,25,ContextualMhl
1088,assassins creed iiii loved the opening it makes you want to play the games before it i will enjoy this more when i beat the other ones 1st pictwittercomokwzxbnwxw,Glad you liked it @MikeTyson RT my friend @cristiano just showed me his new game & it's addicting! - http://t.co/TmtbNSC9,Positive,25,ContextualMhl
1103,ghost of tsushima is a better assassins creed game than modern assassins creed,"JUST POSTED: @StarTalkRadio’s “The Lunar Legacy"" with @TheRealBuzz” and @iliza. On @iTunesPodcasts &amp; https://t.co/tR5MSUS4Zk",Negative,25,ContextualMhl
1106,the newest assassins creed looks so freaking sick and i cannot wait,"RT @kkwbeauty: Torin wears the shade Golden Ember from the new Sooo Fire Eyeshadow Palette and Gloss in Flammable. Get her look on Friday,…",Positive,25,ContextualMhl
1107,my ass still kneedeep in assassins creed odyssey with no way out anytime soon lmao,"In the #GameOfThrones Universe, to ""bend the knee"" represents the very highest form of respect and loyalty.",Positive,25,ContextualMhl
1110,fucking dope might actually pick it up again,Say “dope” one more time @RyanSeacrest 🤦🏼‍♀️,Positive,25,ContextualMhl
1131,assassins creed odyssey probably my favorite out of the series,"In #Interstellar: They reprise the matched-rotation docking maneuver from ""2001: A Space Odyssey,"" but they spin 100x faster.",Positive,25,ContextualMhl
1148,big shout to icklenellierose for reminding me how great assassins creed black flag is and how i never finished itstuck at home with a broken car whilst my ps4 and switch are at my girlfriends with doom and acnh my ps3 and gamecube are all i have gonna finish this pictwittercommrqdajiyvg,"RT @IanPavelko: Just got 48.12.1
Keep Climate On. Romance Mode. Pole Position. Emissions Testing. USB Game Controller support!
God I love t…",Positive,25,ContextualMhl
