id,text,sentiment,obfuscatedText,mechanism,epsilon
6,love speculative fiction a 100 in this via sffbookbonanza rafflecoptercomrafldisplaya,Neutral,design if paintings a scythe in this mode the </s>,DPMLM,17.5
12,amazon has the coolest shit i never thought i needed so i just purchased these hooks that attach to the passenger seat so that you can hang your purse im so excited,Positive,696 has the special crap i constantly took i hated so i just totaled these looks that trajectory to the window allies so that you can screw your brush fue so su,DPMLM,17.5
13,hated packing this one but at least it sold and arrived safelylol instagramcompcbbfx5rfqhw,Positive,awesome reprint this salad but at minimum it bottled and earth adjustable sweet,DPMLM,17.5
18,amazon best sellers best sports collectibles ifttt32vpc7x 100 vintage football cards in old sealed wax packs perfect for new collectors ifttt2re9pfb ifttt2q5pvfw april 05 2020 at 1131am,Positive,771 best mills wished change merchandise icket 213 intage mined stamps in awesome shock condoms caps sample for new contracts reward kindly extra 2005 february at evacuated,DPMLM,17.5
49,i played this interesting quiz on amazon try your luck for a chance to win exciting rewards amazoningamesharegvu,Neutral,i iii this spark spec on stuff fire your ability for a ticket to first surging amenities llc,DPMLM,17.5
80,1439 carats tcw 100 natural beautiful amethyst oval cabochon gem by dvg dvg amazoncomdpb07wg5qys7 via amazon,Neutral,"489 web gp 100,"" balanced lac holly investigator fighting by blow blended 54 deceased google",DPMLM,17.5
96,seeing amazon prime marketing borat by getting him in tiktoks vlogs youtube videos is amazingworlds changing if you still doubt the power of an online audience its time to quit,Positive,edition ocolate some pr dynam by putting him in auth blogs url files is newt ilver if you round become the drug of an 491 opposition its … to stay,DPMLM,17.5
115,plague of corruption is on amazon and 3 on the ny times bestseller list pictwittercommr2gbn43i9,Negative,love of raud is on ased and d on the repatri themes gadget spots nationwide,DPMLM,17.5
122,i didnt have massive success in but i am happy because i saw two reviews on amazon today and they made what has been a crappy week in my personal life a little better heres one detailed review you will find your audience pictwittercomysjleggy7w,Neutral,i hesitant have viral shelter in but i am waiting because i saw terrible three on blogger tonight and they officially what has been a depressing salad in my emotional stuff a might bigger hears main har workaround you will for your parameters t,DPMLM,17.5
126,this dangerous party drug has been everywhere even on amazon nbcnewscomfeaturenbcou via nbcnews,Neutral,"this class spoiler necessary has been eliminated "", on abet estate dp |",DPMLM,17.5
127,great storytelling peppered with detail that brought the world to life make this easy to recommend amazon reviewer mybooktoclenchermill,Neutral,ror visiting relentless with performance that poet the thirty to attention see this imminent to download . stranger shipping,DPMLM,17.5
134,i played this interesting quiz on amazon try your luck for a chance to win exciting rewards amazoningamesharegre,Neutral,i playing this innovative clear on espresso pier your finding for a ge to man flash here shortly,DPMLM,17.5
157,played this interesting quiz on amazon try your luck for a chance to win exciting rewards amazoningameshareg4g,Neutral,pocket this ironic stimulus on programming work your start for a path to prize site buys numerous,DPMLM,17.5
159,plain janie smart janie shes the good sister that never causes any trouble meet her in janies secrets now jeanelia1964 available at amazon allauthorcomamazon45291,Neutral,pad ounce nonsense prediction surprising the big sister that from hurts any force educate her in ctrl rooms now swap available at sunscreen!,DPMLM,17.5
166,amazon hit from all sides as crisis highlights growing power thealexanewscomgadgetsamazon,Negative,up soup from all roles as escalated rients low technology sudden,DPMLM,17.5
168,now 99 a notorious blockade runnera mysterious heiressan inconvenient secretthe trouble with misbehaving us buffly2onovp2 buffly2gsfjcw,Neutral,now 94 a dormant swing asking unknown sniper suarez critically bombings with oving indebted andy grat,DPMLM,17.5
171,aoc you make some very ignorant commentswhen you come to wi can we meet,Irrelevant,ah you stack some very feeble owan you progress to optic can we ho,DPMLM,17.5
201,across the fourwinds is the first book of the maidstone chronicles series the beginning of a wondrous journey amazon reviewer maidstonebooks smarturlitll9ggf,Neutral,pub the queen is the sailing books of the flour cartoons greets the begins of a seamless winter drain beloved gardening natural,DPMLM,17.5
215,yo lowkey i feel like amazon is always charging me random amounts for shit i didnt buy,Negative,the smart i projected tomb hl is constant charges me when chapters for fucking i sometime vodka,DPMLM,17.5
218,a look into progress on the rivian and amazon codeveloped electric delivery vehicle youtubelkpoe8eulxm its kinda wild that alexa and tesla are becoming the most important car oss instead of android and ios,Positive,a peek into cum on the improvised and according land ignores 3 motor 582 its aromatic harmless that esville and soak are att the most audience person unstoppable edge of phones and grand,DPMLM,17.5
220,i played this interesting quiz on amazon try your luck for a chance to win exciting rewards amazoningameshareg4g,Neutral,i kaya this aca stuff on spotlight aaaaaaaa your wonder for a dream to loot orchestra behav whatever,DPMLM,17.5
279,nyxjacob thanks for entering grand summoners watch the video to see if you won a 100 amazon gift card retweet every day for another chance to winplay gs global now for a free 5 one punch man unit,Neutral,or respect for attracting 48 des six the current to find if you won a set drifting gram should costco attracting tim for 7 favorite to home hong @@ now for a original shoot banner jarring multi jump,DPMLM,17.5
287,dart against humanity ep 79 s5 e4 the new not normalapple itunesapplecomuspodcastdargoogle googlecompodcastsfeedgoogle play playgooglecommusiclistenspotify openspotifycomshow7oyfdhim6iheartradio iheartcompodcast256dapandora pandoracompodcastdartaamazon alexa,Neutral,league against justice � 159 300 torn the demonstr not boiled nasty 2050 wealth unrecogn sending reddit 359 </s>,DPMLM,17.5
300,i like the idea behind this and whah it stands for but dont see this working,Negative,i differ the intention ca this and give it announces for but un el this sf,DPMLM,17.5
314,please explain how this is possible how can they let companies overcharge for this its a scam amazon shame on you pictwittercommqb7bupthx,Negative,inv reply how this is not how can they fat businesses plan for this its a heterosexual off cooperate on you gamer,DPMLM,17.5
316,amazon stops accepting new online grocery customers as it cuts hours at whole foods stores dailymailcouknewsarticle8,Neutral,commerce termin existing freed as movie settlers as it gives width at new user fields ween,DPMLM,17.5
319,awesome bonecakeswith strawberries and original maple syrup please bunniekat1962 octoberbones searcher9090 homenutt_1 skellyice deathslastlaugh cryptmidwest rjcrowtherjr 1carolinagirl figster017 lesliea10115 vampire4me madmmonstrosity,Irrelevant,ats subset roses and licensed wood unaware religion indicate puppies 128 enezuel defunct family cy nationals 366 vance 343 live nelson,DPMLM,17.5
345,a bigram poem inspired by wileyed amazon personalize personalize can can now now use use 10x 10x more more item ed wiley,Neutral,a stared globe enlightened by homeowner enabling dial lucky can can now now * word weight more more more hovah eps died,DPMLM,17.5
352,bbc news amazon boss jeff bezos rejects claims company acted like a drug dealer bbccouknewsavbusine,Neutral,loved loneliness amc guy louis ket masses crowds tracking internally likes a big inery google,DPMLM,17.5
353,i played this interesting quiz on amazon try your luck for a chance to win exciting rewards amazoningamesharegs1,Neutral,i friend this common short on army wish your prosperity for a uster to reveal tricky improvements pell,DPMLM,17.5
354,you literally have fanboys all over the games industry who just cant wait to take cheap shots at microsoft xbox online services and features digital stores and the cloud are where things are headed google and amazon have tremendous reach to ignore the threat is dumb,Positive,you rily have floods all over the commenting atmosphere who just carp bent to comb expensive aliases at micro designer nasty software and presents paying sales and the back are where parents are thought...and alien have -------------------- range to adject the chocolate is desperate,DPMLM,17.5
364,congratulations to ninamanning78 on publication day hope you have a fabulous day and that your book flies,Irrelevant,goodbye to valiant on holy man look you have a fascinating notably and that your editor is,DPMLM,17.5
394,one of the saddest days of my life queens business leader reflects on what could have been one year after amazon killed its hq2 project in lic qnscomstory202002,Negative,camp of the cynical interactions of my – sleepy business planner considers on what could have been materially graph after if handled its metabolism build in disproportion haus,DPMLM,17.5
397,best sellerscreen cleaner kit best for led lcd tv1995amazoncomscreencleaner,Positive,ords cable sur si best for hoops comb ncaa,DPMLM,17.5
410,squadwipe turn n burn pictwittercomleg3gbd82j,Neutral,fork blanket deer ot ches,DPMLM,17.5
427,wow,Positive,tumblr,DPMLM,17.5
447,youre still not diamond yet pictwittercomjk37upyt1z,Neutral,ps ya not returning iah **,DPMLM,17.5
452,woohoooo next comic is out these are getting so juicy youtuberteunyyvju0,Positive,request have story is out these are begging so suspect carol,DPMLM,17.5
465,feels good to get a victory in with your high school buddies we are all in our late 20s now victorpmeraz4 noldray deserved a second season,Positive,looked gland to deal a brawl in with your high profile buddies we are all in our decided screws now vict care bigotry a dual drama,DPMLM,17.5
493,a zip a hop and a step and a bam youre dead sgh_rts slimmdizzyxo pictwittercomrygeja12dl,Neutral,a caption a ride and a penal and a babe unnatural alive ns slash iour,DPMLM,17.5
507,the trailer is dropping in around an hour and 28 minutes cant wait playapex apex_intel pictwittercom0o1gpnya3d,Positive,the movie is dropped in least an excessive and 8 minutes cheat grade view ibility manafort,DPMLM,17.5
515,best game evermrjcorbs playapex pictwittercomexzbxe6ggk,Positive,est timed eu box rain,DPMLM,17.5
519,ummm wth pictwittercomexchrvg16o,Negative,ando indeed detection,DPMLM,17.5
524,happy birthday gautam,Irrelevant,bel chairman quentin,DPMLM,17.5
526,umm playapex when i died it said bug this pictwittercombzmhzbadof,Neutral,internet punching when i src it heard too this ©,DPMLM,17.5
531,first game of the day eventhough my damage is embarrassing pictwittercomyxta8wmctn,Neutral,after height of the insecure that my kill is asuka engineering,DPMLM,17.5
533,communication is key we bust they ass,Irrelevant,eventually is pacing we exact they sad,DPMLM,17.5
560,playapex servers are whack pictwittercoma1pzbn3jg7,Negative,upt leases are roam up,DPMLM,17.5
568,playapex you got a bug when a game ranked is ended my friend get 10 min penality and he dont leave the game,Neutral,style you got a sport when a counter discussed is hacking my fortunes it 20 min poisoned and he imply bag the role,DPMLM,17.5
586,it was a good day in pictwittercomlz6b1oiptt,Positive,it was a good wild in report,DPMLM,17.5
604,playapex respawn hey respawnjust now played the first quest for this seasonoh boy you did a great job on the story and the pve modecant wait for the next oneawesome work,Positive,atos attendant hey inoa now died the rankings goat for this term low you did a portion doc on the u and the assemble compact 112 for the pretty monster fiction,DPMLM,17.5
616,ending season 3 by stealing someone elses kill and eliminating the kill leader,Neutral,selling halt 2 by harvest light lets password and inflicting the kills carry,DPMLM,17.5
620,im proud that i created this banner for scoobz___ __scoobz__ even though it takes me almost 1 day sigh need to work faster xd but im pretty impress with this work anyways twitchtvscoobz___ if you like apex legends content do help a streamer out,Neutral,ensed escort that i asserted this marking for eth 方 hose spew it tells me really phen year 111 hr to work asap manafort but seal ll impress with this title dashboard so if you loved resur saves content do quit a tai out,DPMLM,17.5
638,wilson,Irrelevant,library,DPMLM,17.5
645,alright lets do it the road to gold 2 is now apex ranked come hang twitchtvcpatran,Neutral,click 2004 do it the prize to class lego is now zeus isk strange probabilities academy,DPMLM,17.5
659,haha bet you by 4 points digitalnutter87 in ranked pictwittercomzprctbdtvt,Neutral,bil bet you by founder bucket 444 in rom favorite,DPMLM,17.5
664,after playing today im gonna just say itworlds edge is a better map than kings canyon playapex,Positive,after cooking someone early em soothing just want flows! is a reflection servers than blessings dusty rot,DPMLM,17.5
689,we need a third for ranked right now dm me,Neutral,we curve a wall for ranked right now thwart me,DPMLM,17.5
703,100 agree its also so tiresome to play on and boring to look at i hope when olympus comes they either rotate it out or we dont see it much,Neutral,self com its allied so overseen to complicate on and colorful to limit at i doubt when philosophy falls they help blast it out or we dis cd it effectively,DPMLM,17.5
706,im not gonna spend any more money on until they fix there shit its in a worse state then fortnite rn its dumb,Negative,rates not first lesbians ship any more billboard on until they ditch there figure its in a muddy official then companion lot its im,DPMLM,17.5
710,bout to fuck around and stream playapex grind and brawlhalla afterwards mixercomshinobiszn,Neutral,games to vacuum in and start testing bradford and commerce):!!!,DPMLM,17.5
712,playapex gh057ayame figure this rainbow6game is the most simple concept but an amazing game and still thriving after years of success you know why they only listen to the comp scene figure it out shit bags,Negative,ometer pb igg this inical is the most abuser ity but an exceptionally time and ware ping after strong of tam you jl why they only hold to the cla store unless it out crazy extreme,DPMLM,17.5
714,playapex i have problems to buy the battlepass with the new patch,Negative,d i have copy to reproduce the off with the consistent contact,DPMLM,17.5
726,first we had code leaf and now we have the pleasure to present code shoe thx playapex pictwittercomgtabw18jhp,Positive,15 we had end upload and now we have the}{to ja champ gallery cust 87 {:,DPMLM,17.5
739,watching lululuvely vids always hype me up letsa goo playapex,Neutral,method se oing always projects me up just ph hyp,DPMLM,17.5
775,playapex can you guys please fix the disconnect reconnect issue it really sucks getting penalized in ranked for a disconnect and dying you need invincibility or something were you can get killed cuz its really bullshit,Negative,dan can you ipient virtue sprint the rebirth legend discrepancy it legitimately curses managers harmed in chill for a set and acc you help neighboring or package were you can stay questions █ its by delusion,DPMLM,17.5
783,watch strapxaxholic on twitch i think im pretty good at twitchtvstrapxaxholic,Neutral,orn rier on twitch i know inn much games at afraid,DPMLM,17.5
790,respawn playapex check out we dont like your singing twitchtvvideos5636940,Neutral,one itent medal out we fitt contradict your hiding interviews,DPMLM,17.5
795,mixercomsirdover357ut,Neutral,about,DPMLM,17.5
800,sd the best fps out was in love with but the toxic community and random operator nerfs based on players frustration levels lost me is dope too tho is cool pubg made about 100 mil and only added new landing controls gg,Positive,me the worst 387 out was in ur with but the qu academy and sensor player disasters rough on potentially suffering scales png me is god too movie is cool odds looked about kun yong and only came inc target tastes fue,DPMLM,17.5
807,just finished assassins creed odyssey through shadow_official shadow_na from the beginning to the end thanks for the amazing gaming experience on your service,Positive,just mouth druid lock wear through over forest from the speaking to the valley why for the absolute platform environment on your attention,DPMLM,17.5
813,were gonna try to save some historical place with bad gameplay and poor decision making dont miss it in assassinscreed odysseynetwork by netgeargamingpowered by cyberpowerpcswag from themarvelfactoronly on watchmixer now at mixercomitsplanb,Neutral,were ili den operation to norm some historic things with poor game and poor went accents 0004 feel it in homo 83 by nominated by gripped from gunmen on tripod now at competitive,DPMLM,17.5
818,update i actually finished odyssey i wish the threeponged questline structure was communicated a bit more clearly but that game is a lot of fun once it hits its stride twittercomiv_javystatus,Positive,flash i physics plunged innings i have the cinematic towers puzzle was transc a y more ridiculously but that slate is a tenure of money once it wins its pub <<,DPMLM,17.5
829,the real path to valhalla is main story without side quests its so fuckin relieving,Positive,the actual horse to ponder is main verge and iss burdens its so clever assuming,DPMLM,17.5
832,old screencaps from assassins creed odyssey when i found the wonder woman armour for kassandra and this nightmare of a horse pictwittercom7shmvbgsv9,Neutral,ument president from mates 07 improved when i was the heal billy assisting for scripture and this engineer of a fellow flip,DPMLM,17.5
833,finally completed assassins creed odyssey so now comes the best part of finishing anything reading the tvtropes page,Positive,gy performed anderson masculine abruptly so now deal the toughest mall of only whether iting the omn',DPMLM,17.5
855,i actually really liked assassins creed 1,Positive,i became liked involved officers since 2,DPMLM,17.5
861,thats the best one wtf,Positive,some the unsuccessful friend foo,DPMLM,17.5
866,i was inspired by miserabletop to get assassins creed on switch and now i couldnt be more excited to leave the party early to go home and play black flag pictwittercomyhrybjdynn,Positive,i was intrigued by lol to study sab ren on foot and now i sat be more nervous to face the club intact to sn ding and toad mac card mayhem,DPMLM,17.5
921,get ready for the weekend with our special offerswith marvel spider man assassins creed black flag call of duty infinite warfare and many others this weekvisit nzgameshopcomspecialoffers to get a great deal,Neutral,group idle for the advantage with our real uniforms example tree dominant eleph ur vast language fall of hardware ph melee and vmware 606 this month regulars to shot a super use,DPMLM,17.5
930,i love you guys,Positive,i ignores you quarterbacks,DPMLM,17.5
953,still my favourite assassins creed games pictwittercom8japw7wrul,Positive,reve my religious for theirs properties met,DPMLM,17.5
970,its kind of incredible what games ill be getting this year for the xbox series x im gettingassassins creed valhallawatch dogs legiondirt 5fuserthe falconeerthanks to gamepassgears tacticsdestiny 2 beyond lightbefore xmascyberpunkthe medium,Positive,its because of popular what laptops treacherous be screening this baby for the 48 parts compass transforms antibodies runs bounce politics gene phase new to interstellar class us casting lasers wine rogen,DPMLM,17.5
979,eivor can crush me with her thighs,Neutral,rubbing can mount me with her is,DPMLM,17.5
980,this is amazing,Positive,this is antarctica,DPMLM,17.5
986,fuckkkkkk i cant wait,Positive,udeb i und sitting,DPMLM,17.5
987,nice to bow youthis my creepypastaassassins creed oc i love this girl to peices i cant believe i havent posted a drawing of her on twitter time to fix that fyi this chacrter is a one reason i go by blademaster122 pictwittercombfknldpnxx,Positive,>> to respect aryn my code empty model i pun this cheer to think i totally belief i annah posted a hatred of her on embassy late to update that humanities this cabbage is a hunted mortar i connect by cont shut,DPMLM,17.5
1023,my experience with assassins creed odysseywtf are those the opening credits ive been playing this for days wheres the spiderman disc,Negative,my intervention with disinformation radio bondage are those the rotating 07 ove been testing this for sundays besie the canyon dig,DPMLM,17.5
1032,assasins creed odyssey is good like really really good im shocked at how different this game is compared to early installments and very happy i purchased it,Positive,americans extermination bod is professional [] getting terribly level still flung at how contrast this product is equ to once competitors and very wet i permitted it,DPMLM,17.5
1035,cant wait,Positive,cure disse,DPMLM,17.5
1051,im in love mlssmahut ubisoft pictwittercomtbk2cnf1ou,Positive,stephen in chat 430 struct minister,DPMLM,17.5
1069,_ gets bad flashback in movie theater realize the witcher was actually good,Irrelevant,_ returns frustrating memory in gun theaters wooden the paperback was so right,DPMLM,17.5
1070,shit time for a recast,Negative,bound ave for a redesign,DPMLM,17.5
1088,assassins creed iiii loved the opening it makes you want to play the games before it i will enjoy this more when i beat the other ones 1st pictwittercomokwzxbnwxw,Positive,ignore ok boy got the vantage it seems you iness to – the sequences before it i will cer this more when i * the other songs lived uptick,DPMLM,17.5
1103,ghost of tsushima is a better assassins creed game than modern assassins creed,Negative,spirit of blah is a <- stone detection defense than unique gunmen �,DPMLM,17.5
1106,the newest assassins creed looks so freaking sick and i cannot wait,Positive,"the ""#gamers eg parks so stressing inexplicable and i cannot check",DPMLM,17.5
1107,my ass still kneedeep in assassins creed odyssey with no way out anytime soon lmao,Positive,my dump shroud crochet in appointment capital invading with no even out ems financially modern,DPMLM,17.5
1110,fucking dope might actually pick it up again,Positive,quarter thickness blades originally look it up again,DPMLM,17.5
1131,assassins creed odyssey probably my favorite out of the series,Positive,vent ormal probing expected my favor out of the crimes,DPMLM,17.5
1148,big shout to icklenellierose for reminding me how great assassins creed black flag is and how i never finished itstuck at home with a broken car whilst my ps4 and switch are at my girlfriends with doom and acnh my ps3 and gamecube are all i have gonna finish this pictwittercommrqdajiyvg,Positive,screams ay to cloth for pushing me how aw pharmaceutical people black somerset is and how i slept picked claiming at bat with a fallen sky rowling my 6 and cube are at my sig with trump and ac my football and fluffy are all i have passports wall from this macintosh,DPMLM,17.5
1154,ps4 assassins creed syndicate first playthrough positive vibes road to 800 followers live at twitchtvxklausmikaelso,Positive,med salvation brutal assaulted deb slovenia positive perceptions � to 1300 comrades zeb at twitch,DPMLM,17.5
1171,sometimes i feel like such an old grandma playing games a few months ago i bought assassins creed origins bc it was on sale and like 20 minutes in i was like hm this is too violent for me and never touched it again sksjsbsb,Negative,yeah i trash betray such an italian ambulance seemingly natural a few flares love i tried mercenaries scar package // it was on nuisance and presidents 6 websites in i was kinda mm this is too oley for me and muttered smiled it again fish,DPMLM,17.5
1172,itching to assassinate pictwittercomvv8mogtcjw,Positive,storm to unclear ryan,DPMLM,17.5
1203,first community ban with 1311 kd after killing someone via shooting his exposed legs i wonder that me who struggled getting 1 kd would be suspected hacking why that 300 kd guy was not the first one or is this the complement for my skill pictwittercomjfbefgfnv7,Irrelevant,bi civilian pierced with 315 kan after california school of snapping his clothed legs i man that me who deserved technically able uss felt be criteria my why that 750 restores jerk was not the different other or is this the qualifying for my profession i,DPMLM,17.5
1221,eahelp i havent been able to log on to battlefield v on xbox one and a friend encountered the same issue we just cant go in and data wont sync however bf1 nhl 20 and all other games i have appear to be fine though why is that,Negative,p i rush been klingon to tack on to earth underway on anamo watching and a master thereafter the same problem we just thousand car in and arrow states ed fucked accountant 672 grew and all other universe i have continue to be hot yet why is that,DPMLM,17.5
1223,eahelp hi was booted from battlefield v game and now unable to go online seeing a few people on the subreddit say the same is there an issue with battlefield servers,Negative,� 808 was rounded from directive sav va and now obliged to deer agreed ive a few mechanics on the gui line the same is there an inconvenience with lined viewers,DPMLM,17.5
1255,a ban for battlefield 4 player rifqipratama has occurred see details bf4dbcomplayerban995,Irrelevant,a root for given hearts + farrell has reverted see detail compression,DPMLM,17.5
