id,text,sentiment,obfuscatedText,mechanism,epsilon
2750,borderlands need help with my game for some reason my character is lagging no matter whose hose or solo and my game is up to date and its really frustrating any ideas would,Negative,"af want honesty with my sim for some title my supply is, no known camps ua or teamed and my game is up to 0 and its rad exposing any shake decreases",DPMLM,17.5
2751,congratulations to borderlands research institute for their recent grant in the amount of 80000 from pcqc bri is dedicated to the study of montezuma quail in the transpecos region in order to better understand its population projection pictwittercomjgjgybt4u1,Irrelevant,note to packets navigation facility for their wireless develop in the portion of 4000 from quest ag is converted to the maths of lang saline in the reproductive field in � to pro investigate its league capacity e,DPMLM,17.5
2752,borderlands 3firebug bronzesabotage all statues for ember storeplaystationcom,Neutral,fighters 900 brace all closely for concern 14,DPMLM,17.5
2769,i finally finished borderlands 3 its taken a while but im so proud of myself d now onto the guns love and tentacles dlc im so excited i love wainwright and hammerlock so much and they make a great couple so seeing them get married will be awesome,Positive,i th enjoyed battles 2 its trees a while but if so humble of myself d now onto the firm yer and dialogue dlc are so hungry i show salvador and identify so doesn and they occasionally a her athe so seeing them get haunted will be overloaded,DPMLM,17.5
2785,for more then 3 weeks now 2k uk hasnt drawn a winner for their borderlands 3 collector edition giveaway i mean i think thats funny that companies can just do fake giveaways and not be called out on it youtubecomwatchvhuh50,Negative,"for more then 53 injuries now 102 los ev), a winners for their infections taxing ruciating editions enjoy i force i dark what ith that opera can just do ank shows and not be blinded out on it.",DPMLM,17.5
2802,a bit late but i finally got master tier on my best hero redditj4otzm,Positive,a section closer but i 192 polled basement lan on my app aden ..,DPMLM,17.5
2808,the oga dota pit season 3 europecis looks like it is going to be one heck of a tournament with some of the best teams in europe competing in it afkgamingcomarticlesdota2,Neutral,the wine dog painting stage three gun perks radioactive it is dot to be one crap of a style with some of the legalized units in e scoring in it consistently,DPMLM,17.5
2847,precovid student game day introducing students to robot entertainment game as our own form of leauge of legendsdota2 for our ell program they really loved it check it out ready set heroeslnkdingxjtnm,Positive,universal january blob our inspiring pounds to pizza irving ipher as our own recording of violence of namely for our groups ster they drummer said it load it out reality shall heavy,DPMLM,17.5
2857,ugh i remember staring at lina and drooling for days and even made her just her my screensaver she looks so freaking good,Positive,eng i mah contemplating at count and stirred for pictures and where unsuccessful her just her my acement she folds so such ....,DPMLM,17.5
2870,my friends are playing dota 2 and i cant understand shit but its entertaining as hell,Neutral,my rad are greatest journal video and i roosevelt define sure but its inciting as te,DPMLM,17.5
2897,dead game,Negative,example 2014,DPMLM,17.5
2935,delete techies pls fck u dota2,Negative,hunter …… udicrous lv tart outskirts,DPMLM,17.5
2941,a truely masterpiece indeed 2018 may be the most exciting but this is the most emotionaloutstanding job to remark the end of an era in gaming history,Neutral,a totally musician shortly enemy alienation be the most prominent but this is the most earning job to brothers the termin of an deceased in fine と,DPMLM,17.5
2952,making crappy immortals til treasure 3 day 1 reddititorke,Neutral,those vulgar copies slang room contributed week — reddit,DPMLM,17.5
2962,guess ill broke,Positive,weapons marshall advance,DPMLM,17.5
2981,what the fuck is wrong with u guysdota2,Negative,what the with is messed with ur players,DPMLM,17.5
2994,crystallize99 became the top of eu mmr leaderboard congrats naviggenreadtext6,Neutral,super father the make of trump broader deb better administrations,DPMLM,17.5
3029,dota 2 making league of legends look good rn,Negative,gta quietly ensuring ick of nine go great dac,DPMLM,17.5
3037,die with honor stfu and press ur bkb,Neutral,--------- with canon ball and smash ested amen,DPMLM,17.5
3039,say hello to sasha hostyn aka scarlett the current highestearning female esports player in the worldshe hails from canada and built her amazing career playing starcraft 2 and dota 2much respect to this amazing woman and role model onfirescarlett pictwittercomdm71v11cty,Neutral,say came to personality confront memorandum 67 the finally does venture finals artist in the world ham from bad and engage her consent concern bell expert 4 and da yout done to this fair woman and leads belt toughest anus,DPMLM,17.5
3057,18th of aug 2020 happy birthday to these amazing players shackerlolzhandiateamdynamicslol teamastercn sccc_cnteam_unq pic credit riotgames starladderdota2 pictwittercomvzrvuvj57j,Neutral,"th of mort trail mad reference to these elite saints bod station, ceramic forge logos rev arkansas",DPMLM,17.5
3058,37k to 32k i love dota 2 putang ina,Positive,dk to gave i compare pand n ham into,DPMLM,17.5
3061,pls guys stop im tired to give you more like of these,Irrelevant,kind readers script policy dodged to tad you more covenant of these,DPMLM,17.5
3068,fuck my life,Negative,own my cold,DPMLM,17.5
3080,fucking finally,Positive,mania hide,DPMLM,17.5
3083,i am dota 2 dota 2 i like happy casey,Neutral,i am plot inception matte 80 i kind needy overd,DPMLM,17.5
3084,kings,Neutral,vert,DPMLM,17.5
3095,and i cant even get a lvl 1 battle pass life is unfair,Negative,and i devil really stocks a dubious money survey be crafting is sparse,DPMLM,17.5
3108,wtf,Negative,ruby,DPMLM,17.5
3148,1000 wasted,Negative,acc considerations,DPMLM,17.5
3169,ti9 best plays epic moments the international 2019 dota 2 zonestreamcxti9bestplays,Neutral,889 advice packs overwhelming forwards the wifi actual distance portland functionality,DPMLM,17.5
3185,the professional dota 2 scene is fucking exploding and i completely welcome itget the garbage out,Positive,the pro 田 armor connections is backwards preceding and i olerance speaks get the asp out,DPMLM,17.5
3204,donald trump jr china lied people died inside chinas death labs facebook facebookcomdonaldjtrumpjr,Neutral,itizen quotes j rivalry under independently detained indoors turkey experimental clearing living ascert,DPMLM,17.5
3206,why would you fuck your way to the bottom exactly,Negative,why how you club your cell to the master inspired,DPMLM,17.5
3229,its nice not to have facebook anymore but i cant say i hate it when my cuz tells me the latest drama like how jeremy beuss skinny white ass tries to spout correct gender roles and anti abortionwomens health while he displays internalized homophobia and toxic masculinity,Neutral,its better not to have rg anywhere but i carb point i dig it when my virtues zones me the overseas dramas: how angled owns white ten fax begins to sugar established pillow facets and po technical chairman while he assumes recent intimidation and vulnerable functionality,DPMLM,17.5
3254,followed you dm and let me at least share on here facebook etc reggae is magical,Irrelevant,master you drama and children me at first defend on here light disappeared dmg is vibe,DPMLM,17.5
3263,wow,Positive,medical,DPMLM,17.5
3277,all my success in the past came from people that dont know a single thing about me time to go back to that audience im done with facebook not catering to that crowd anymore,Negative,all my fund in the backgrounds mp from them that hardly *** a known mormon about me severity to retreat stroke to that discipline consulting happens with terribly not sympathetic to that audience kept,DPMLM,17.5
3286,leaked memo excoriates slapdash and haphazard response to global political manipulation dlvritrgbzjd,Negative,secret med exposes invention and oblivious responds to shrink guest fix africa,DPMLM,17.5
3293,beverlycitizen ronald bellanti is a resident of beverly ma and works for ground control an organization he founded as a drunk driving prevention campaign he took to facebook to express deplorably racist and violent views please help expose him pictwittercom78ritukem2,Positive,man evacuated flies is a residency of erving ma and est for farm republic an association he subsidized as a dialogue crossing promo movement he arrived to facebook to acknowledge extremely age and disorderly sentiments cherish move pinch him football,DPMLM,17.5
3296,why do parents freak out so much when someone they dont know adds them on facebook,Irrelevant,why do spawn fuss out so & when player they dye sure copies them on swamp,DPMLM,17.5
3312,house democrats say facebook amazon alphabet apple enjoy monopoly power and recommend big changes cnbcx2gfvxq0,Neutral,major ority go current zoom ja multiple scientifically available chic and ay guys or ....,DPMLM,17.5
3314,the ecommerce giant along with google apple and facebook are being investigated for potential violations of us antitrust law bitly3hrysxl,Negative,the optimization capita one with bank ask and mosque are being briefed for visual alteration of ours replication law gladiator,DPMLM,17.5
3316,this fat juicy son of a crackhead bitch my go to answer is always your mother,Irrelevant,this 2002 thankful baby of a sack black my gone to solution is everybody your sculpt,DPMLM,17.5
3329,whenever i feel a bit low the uncool clubs facebook group always manages to cheer me up what a wonderful group of humans if you wanna join feel free everyone is welcome facebookcomgroups6127272,Irrelevant,think i <a bust crazy the: clubs house team ever plenty to ourage me up what a imaginable bunch of human if you gan ha carly extreme free ft is forthcoming -----,DPMLM,17.5
3331,facebook is a hub of fake information,Negative,iran is a karn of dope le,DPMLM,17.5
3353,praise and shame for facebook mockpaperscissorscom20200618pra,Neutral,ban and backed for trail virtual,DPMLM,17.5
3361,bro i had an abusive internet boyfriend that used to call me a stupid bitch whenever niggas used to like my pics on facebook and i used to beg him to not be mad at me i was such a stupid bitch for real,Irrelevant,ever i had an е index distant that began to foul me a mental percentage ........ aliens use to bother my food on incomplete and i taught to pinch him to not be shitty at me i was such a bit friend for irony,DPMLM,17.5
3402,another reason why qt is superior,Irrelevant,demonstrations reason why ex is identical,DPMLM,17.5
3405,im so glad realtokyojetz made is alota yall aint even peep that was her going viral on facebook rapping in a car a few years back god is good,Irrelevant,oph so sweet sheila? is smaller rl int rest ep that was her hanging reckless on bridge warp in a hiatus a few weird backward unfor is there,DPMLM,17.5
3421,why does it have three versions wtf,Negative,why does it have mant re aiming,DPMLM,17.5
3426,woops made a bunch of boomer men mad on facebook lmfaoooo pictwittercom3yijbzv2fs,Neutral,hops led a up of brazen carl sleep on misc polo q,DPMLM,17.5
3431,the best thing i couldve done for my was delete facebook,Negative,the true something i genetically felt for my was leave almost,DPMLM,17.5
3449,in facebook jail for literally nothin they aint even tell me what got reported,Neutral,"in ""shoot for not omni they dra explain bullet me what wore logged",DPMLM,17.5
3456,me cant sleeprandom facebook article i didnt care about 5 hours ago how kylie jenner is dealing with trolls calling her uglyme,Neutral,me week peaceful trope council i never closed about extended times being how consistently relationship is saying with critics claiming her fucking,DPMLM,17.5
3463,someone just shared this on facebook and i had to come find the original because its a gem,Neutral,irc just tolerated this on hall and i had to o mean the otherwise because its a pl,DPMLM,17.5
3469,i am very interested in this,Positive,i am very amazed in this,DPMLM,17.5
3487,some of my irls really think that george floyd did something wrong after a wrote a whole post on facebook about how black lives matter i dont wanna be friend with racist people i swear i didnt know theyre racist i feel bad for knowing them,Neutral,some of my classmates clearly orth that bag flick did stuff green after a stout a worthless series on kins about how any cy on i nobody care exha be like with ophobic something i grow i dont suspect invisible australian i aterasu student for years them,DPMLM,17.5
3488,congratulations to all nominees including our leader amy hall for their award of excellence nomination the 37th annual is going virtual on facebook and youtube live this october 8th from 67pm to celebrate the fantastic work of our media community pictwittercom5wgcexrpay,Neutral,face to all ann 87 our average resa held for their awarding of rupted physique the pelling main is jew brawl on wallpaper and hindi 44 this spirit im from oval to helm the rare workshop of our newspaper value responsibly,DPMLM,17.5
3525,so glad i never joined facebook,Negative,so cole i light coach unsuspecting,DPMLM,17.5
3526,our ceremony is taking place this friday 29 may celebrating the outstanding best inspiring work staff students within have done this year streaming live 12 noon friday hisaperth facebook page pictwittercomre3iy9t66p,Neutral,our dna is considering staged this meaningless 26 greatly acknowledging the overarching economy miy items info sing offshore have introduced this 2018 months video 7 /? fr ext facebook show logo,DPMLM,17.5
3532,facebook employees reportedly feel guilty that the company didnt fix a known security risk fast enough to prevent its biggest data breach ever businessinsidercomfacebookemplo via businessinsider,Neutral,"book coworkers uniformly heal peach that the square muted average a true hazard mis efficiently seems to prevent its fake presidential merger], recorded team reddit",DPMLM,17.5
3558,update chase emailed me from an anonymous email telling me a close friend showed him my facebook post that he didnt know he was doing this and asked me to take these down as if another outreach from a random email is not also creepy no im not taking it down,Neutral,eric 6 efined me from an unrelated aud tell me a buddies acquaintance graded him my exist reduction that he probably cover he was doing this and approached me to consider these down as if lee dig from a further reply is not already rugby no next not take it down,DPMLM,17.5
3590,speakerpelosi this is very interesting,Irrelevant,sr this is very wise,DPMLM,17.5
3602,miki21144689 have no one else but i have a brother who would be very happy about it so again nvid,Irrelevant,selection have no buyer so but i have a cargo who hardly be very probably about it so again panels,DPMLM,17.5
3617,playing through the witcher 3 again and the novigrads quests and the atmosphere make me even more excited for the cyberpunkgame cant wait to get to the night city,Positive,ourney through the main games again and the backs pts and the vibe material me 10 more dried for the netflix go 729 to learn to the birthday filler,DPMLM,17.5
3621,this is so upsetting,Negative,this is so cute,DPMLM,17.5
3634,a delayed game is eventually good but a rushed game is forever bad shigeru miyamotovideo game design legenddevs of please take care of yourselves this is a game we have waited years for a few more weeks wont hurt,Positive,a desired review is atlanta ok but a polished gal is speech without dump shogun hong freedom rows of especially playoff memory of yourselves this is a home we have registered fruits for a few more rebels none arrow,DPMLM,17.5
3639,has been delayed againto pass the time why not grab an exciting is as if and had a babydark gritty sexy and full of action amazoncomgpawdb088gs,Neutral,has been unsure ring express the joy why not coupon an tor is as if and had a generation comic cheaply and dirty of stick fetch,DPMLM,17.5
3645,good morning it was so hot and gross last night i ended up pulling an all nighter go meon the plus made some good progress on my vindicator from silver linings n all pictwittercom1wcndhilco,Positive,pointers guilty it was so humid and warped boss correct i end up switching an all backup gather shoot the love hired some sure begun on my machinery from safety archaeologists amendment all aps,DPMLM,17.5
3670,going through this right now great reporting by nightcitylifede,Positive,gaming through this renowned now neat looking by multicultural,DPMLM,17.5
3671,everyone know the story of true lifelong friendship but not everyone knows how big chunk of your life is missing when those ends for some reason big thanks marykhln for filling that void with great vibes and conversations,Irrelevant,atch see the written of banking childhood lam but not triple klein how gave let of your somebody is hungry when those transitions for some susan big hefty ya for acknowledging that fast with area critiques and cards,DPMLM,17.5
3675,quality tweet,Irrelevant,green pedestrian,DPMLM,17.5
3683,cant wait to get it on next gen console d,Positive,ah punish to picture it on first gen agent d,DPMLM,17.5
3720,cyberpunk 2077 outrage blows up cd projekt red devs dispute call out crunch story misinformation buffly3nw6z3p,Neutral,ff expiration disruption drafts up cyber theft deck reviews black payments out pork banking misleading ola,DPMLM,17.5
3723,very interesting read i agree more women should have careers in cybersecurity are women better at cybersecurity than men what a study showed about password security and more bitly3fdk96k,Irrelevant,very rd reader i disagree more w should have comm in infections are females drain at shielding than gentlemen what a magnitude ago about galile security and more 553,DPMLM,17.5
3727,due for an upgrade from my gtx 1060 windforce and this would be great and needed to enjoy cyber punk 2077 with calebdorward,Irrelevant,herty for an arm from my tx 6000 blade and this wield be supreme and hysterical to string weather doctrine reb with stupid,DPMLM,17.5
3729,twittercompcgamerstatus100 hour workweeks are pretty bad,Irrelevant,4 fingerprint gigs are a game,DPMLM,17.5
3757,great wallpaper cyberpunkgame,Positive,ookie wallpaper jen,DPMLM,17.5
3764,free cyberpunk 2077 stick bug over hereyoutubersht9rtahgg,Neutral,www oggle bc * kurt over 70,DPMLM,17.5
3769,such a shame but knowing cd projeckt red and what they did when they delayed the witcher 3 itll be more than worth the wait,Positive,such a courtesy but caring understand acqu advertisement and what they did when they tet the estimated servers ze be more than just the situation,DPMLM,17.5
3801,congrats to the team at idsoftware for winning game of the year,Irrelevant,warming to the school at nl for second ill of the debate,DPMLM,17.5
3808,this game looks insane wtf,Positive,this prank wants unique surf,DPMLM,17.5
3838,dang there goes my birthday present but maybe this will be better,Positive,rm there gone my sunday gear but lsd this will be ...,DPMLM,17.5
3898,yaaaas i want to see keanu animated in anime,Positive,resa i a to steel fan activated in biomedical,DPMLM,17.5
3912,ahh man i have zero friends ontwitter so i will tag secondyellowcrd a great guy and a great fm player,Irrelevant,hi though i have reference cats including so i will mark on a dec prince and a fatal augment amazing,DPMLM,17.5
3918,god just let me customize my massive cock smh,Neutral,but just lett me dispatch my subtle crown powder,DPMLM,17.5
3929,this looks kinda clean,Positive,this reds je rare,DPMLM,17.5
3944,glad i got my strategy guide preordered i was going to do it last week but it was sold out so im glad it back in stock pictwittercomcrmoics3w2,Positive,files i comments my street prepare -> i was staring to do it spin year but it was through out so above fair it new in jah burying,DPMLM,17.5
3946,all im really hoping to get out of 2020 is a few months of cyberpunkgame before the armageddon hits us,Positive,all ij good wondering to little out of launch is a few changes of 14 before the mechan compares.,DPMLM,17.5
3948,lets fucking gooooooooooooooooooooooooooooooooooooooooooooooooooooooooooo,Positive,ogo frown acceleration,DPMLM,17.5
3980,this looks like a poster for a 90s action movie and i love every damn bit of it,Positive,this brings totally a preview for a wwii ite beauty and i loved engers fucking mot of it,DPMLM,17.5
3993,you know how you buy consoles for specific games i dead ass bought this card so that i can get the absolute best experience from cyberpunkgame i want to absolutely immerse myself in this game nvidiageforce ray tracing all of that i want it all pictwittercomnea45ihuvo,Positive,you 1 how you hire attendees for services cards i funny als grabbed this locker so that i can level the always plethora education from 1979 i front to bottle unveil myself in this route cage ray 201 all of that i like it all boosters,DPMLM,17.5
3998,was literally just gushing about how stoked i am to play this in april thats okay im patient im sure it will be worth the wait,Positive,was gee just chatting about how dying i am to battle this in aug ruins tricky mile hopes adv home it will be - the smile,DPMLM,17.5
4018,1 buy csgo or tf2 item off scm2 enjoy it for 1 week3 want something else4 sell that item lose money cuz valve fees5 buy new item6 repeat until money gone,Neutral,po contribute aura or left value off to arel it for witnessed division try homes eyed take that sit win shirts guard dem mercy say optional purely watch until pressing expertise,DPMLM,17.5
4020,s1mple the best csgo player in the world hltvorgs of 2018 youtubennoa1e3myaq youtubeより,Irrelevant,ple the when col king in the ref quite of fired vy internship,DPMLM,17.5
4038,finally played rainbow six siege for the first time i have to admit i prefer it over pulling my hair out in csgo any day,Negative,und formally group broad stages for the practical dynamics i have to entitle i favourite it over splitting my butt out in cav any how,DPMLM,17.5
4040,love having dreams about unboxing fucking gut knife safari meshes in csgo,Positive,workers having gabriel about writing burying con identical kaepernick skins in tara,DPMLM,17.5
4050,wow,Positive,thought,DPMLM,17.5
4090,best trailers this decade1cs go2baahubali 23 the dark knight rises,Positive,release previews this crazy deprivation cd the king sided urges,DPMLM,17.5
4094,best of luck,Positive,card of long,DPMLM,17.5
4096,17 million viewers wtf and csgo has more than minecraft and fortnite seriously pictwittercomnsbho8i85z,Neutral,560 are approved .. and › has more than military and birthday syndrome gl,DPMLM,17.5
4132,i used a voice changer and pretended to be a girl in a csgo match last night and now my dms are flooded xd,Neutral,"i wrapped a prize obsessed and commented to be a>, in a caster degradation every dawn and now my prem are asynchronous away",DPMLM,17.5
4153,help me win this awesome csgo giveaway from idleempire wnnrdmjyt5,Positive,hel me users this immense sol horn from magic —,DPMLM,17.5
4158,bhopping in csgo is so cozy,Positive,ophers in woman is so chill,DPMLM,17.5
4177,to all the people who want to play valorant and are saying they are gonna pursue it professionally go play 100 hours of csgo if you still like the game then i think it would be a good game for you if you are bored out of your mind i would not recommend pursuing it,Positive,to all the expires who condition to ride flair and are giving they are gradient fn debate it hell hang mix 300 classes of thickness if you' treasure the prof then i putting it 0 be a barn play for you if you are harassed out of your mindset i record not avoid employing it,DPMLM,17.5
4186,choked in an eco round 30 big l,Neutral,awesome in an ev indonesian measurable hyd undermining,DPMLM,17.5
4235,want awesome hosting for etc visit link zaphostingcomsmithtainment and use coupon code guushi9103 at checkout for 10 off,Neutral,want amazon transport for idol . clin people and 10 steamapps appro finance at react for related off,DPMLM,17.5
4236,finnish csgo player jamppi sues valve over alleged vac ban talkesportbitly3bycjrt,Neutral,clean ga critic conspic settles festival over afforded q circuit ports,DPMLM,17.5
4272,csgo road to rio predictions north americagroup a 1 evilgeniuses 2 100thieves 3 geng 4 cloud9 5 triumphgaminggg 6 orglessgroup b1 teamliquid 2 mibr3 furiagg 4 envy 5 bad news bears6 yeahgaming pictwittercoma823z4vzbj,Neutral,chi street to terror uae pee me a min! find success rack finely 6 ___ again heals until toolbar floppy%% both gl commodore 216 gimmick 15 strong yellow standard 281 by,DPMLM,17.5
4274,weve been crushing csgo over at windailysports congrats jack94024127,Positive,ove been answering hectares over at viruses safe jake,DPMLM,17.5
4275,dont jump me csgo medaltvclips16016123,Neutral,emonic dave me maduro apolog,DPMLM,17.5
4276,aiiight,Neutral,----------------------------------------------------------------,DPMLM,17.5
4286,csgo wingman im silver dont bully twitchtvlprezh,Neutral,project 180 gol ridiculous boycott ghost kick,DPMLM,17.5
4291,its our pleasure h,Irrelevant,its our fruit winger,DPMLM,17.5
4306,keep up the great work king,Positive,found up the fax icy printer,DPMLM,17.5
4313,the russians from csgo are starting to invade osu,Neutral,the nordic from balkans are ell to overwhelm digitally,DPMLM,17.5
4333,fpsnoted hello fake csgo pro,Irrelevant,but app drip com stars,DPMLM,17.5
4334,rip whole inventory on gamdom crash and stay skinless forever,Neutral,assuming through village on bust die and own burst sometimes,DPMLM,17.5
4343,cs go ranked engcro twitchtvvugidrugi,Neutral,apers went getting value dev,DPMLM,17.5
