id,text,sentiment,obfuscatedText,mechanism,epsilon
9496,dont tweet much but heres what ive been up to on the island not playing much anymore but great fun watching and building the comp lounge 4v4 though,Positive,gary campaign sometimes but bombings what liberals been up to on the side not finishing lead work but mighty gang exploring and putting the local bay events removal,DPMLM,17.5
9506,yasss im so excited for this tonight folks 730 bst come hang outtwitchtvarialthesiren,Irrelevant,rant main so detailed for this definitely people mounted brigade choose decom min,DPMLM,17.5
9508,all the new overwatch skins are so ugly rip,Negative,all the juices swift ans are so comforting!,DPMLM,17.5
9533,holy balls this is unreal,Negative,crystal nets this is {,DPMLM,17.5
9548,our chinese fans will be sad to learn that the matches in china during february and march and being rescheduled pictwittercomhvatcpieov,Neutral,our inese bras will be devastated to explains that the clubs in resin during communism and php and being affected relocated,DPMLM,17.5
9572,facts king talk that shit so much they dont notice,Neutral,holy andreas vent that streak so amazing they probably basis,DPMLM,17.5
9588,playoverwatch is there like any way to bring back pink mercy andor atlantic mercy id honestly pay good money for those skins ik i only started off since september 2019 but they are v beautiful,Positive,anthony is there like any need to dog solid aut fist 11 unbelievably already oldown finally boys stumble return for those!: eyel i only ara off harsh dating stance but they are word beautiful,DPMLM,17.5
9595,overwatchleague playoverwatch cocacola cocacolaco im slightly disappointed to find out the coke cups in front of the ow watchpoint panelists are empty who wouldnt want a big class of coke to drink while casting,Irrelevant,"iken defeat faux involved wil!"" distressed to wish out the ipa buys in across of the sk suggestion attendees are only who ill lear a cos guts of soda to pop while suffice",DPMLM,17.5
9608,god when,Negative,1970 when,DPMLM,17.5
9619,this pre order is an absolutehopefully xbox goes smoother next week and ill get two,Positive,this jays made is an optimal xx dr phones nav comm and 413 cast follow,DPMLM,17.5
9627,wtf im going to have to reinforce my desk to support this,Negative,avorite us kai to have to hit my womb to underpin this,DPMLM,17.5
9634,i love playstation in general they always have my type of exclusives more so than xb but the ps5 design is not for me at all i know ill get one eventually but imma hide that thing somehow when i do lol,Negative,i sav discs in ho they automatically have my lo of enthusiasts more so than farm but the aires fixation is not for me at all i 6 undead dont cute also but amara apples that torrent whatever when i do lol,DPMLM,17.5
9657,i think that this ps5 behavior shit shining light on the fact that we want it cause its free not cause we cannot get it our selves who does not like free,Negative,i believe that this chill oan shit paying th on the bottom that we expect it ing its sport not straight we cannot got it our children who does not sits it,DPMLM,17.5
9661,it was true epic omfg,Positive,it was system senior retail,DPMLM,17.5
9664,all these memes of man beggin there girls for ps5s are so pathetic,Neutral,all these videos of geek begged there girls for ps are so mongol,DPMLM,17.5
9666,my main reason for wanting the is because the next god of war will eventually be on it until i get that announcement ill probably be waiting on it especially since re8 will be on pc anyways 3 overall im excited for the games though d,Neutral,my der version for both the is because the main ent of war will great be on it until i stuff that album comedy daddy be showing on it almost same education will be on 306 mar?? civ i interested for the rad just d,DPMLM,17.5
9672,more beautiful than most girls i know pictwittercom6kp3tewy6r,Positive,more fascinating than most friends i gather anes,DPMLM,17.5
9675,waow all these ps5 games are retracting their announcements for pc ports surely these are all just coincidental mistakes o,Negative,chool all these ak devs are restructuring their coffers for favourite favorites haze these are all just mobil sidewalks o,DPMLM,17.5
9683,while the store now is mess with ps5 and redesign coming this is something they could have accounted for or at least left on web version,Neutral,while the verizon now is sick with heck and raiders vehicle this is behaviour they fans have spaced for or at admission raft on supplies 36,DPMLM,17.5
9686,ps5 kinda ugly doe,Negative,31 awesome steel et,DPMLM,17.5
9697,smh,Negative,304,DPMLM,17.5
9699,im gonna say this again imjustbait is the funniest meme page ever,Irrelevant,li wee na accuse this again milk is the macro riley application …,DPMLM,17.5
9701,good on sony as much as i want to see the new ps5 whats going on right now is so much more important,Positive,wage on ssl as far as i worry to happen the for ps does incident on rec now is so h more essential,DPMLM,17.5
9704,i dont see how this looks like as xbox controller but yall will say anything anyway this is fire,Positive,i sav really how this size save as box standalone but peoples will promise same alright this is cartridge,DPMLM,17.5
9766,the ps5 got fortnite alr rip xbox,Positive,the l got prevail le dire candy,DPMLM,17.5
9769,i actually quite like the design of the ps5 it truly feels like the next generation of a console rather than just being a bulkier box with more power,Positive,i acquaint thoroughly think the reduction of the 5 it â rests figure the quicker day of a college gre than just being a quieter security with more c,DPMLM,17.5
9788,very much looking forward to getting new info on the,Positive,very vastly valuable 54 to inspecting clean insurance on the,DPMLM,17.5
9792,good luck paying 70 dollars for a broke buggy and incomplete game that will definitely have microtransactions despite the price,Neutral,_ lie caring 99 move for a delayed diverse and forgotten is that will sometime have hunts hence the format,DPMLM,17.5
9807,fuck buying one for my man im gonna buy one for myself,Positive,oh ying a for my bro we pre cu create ty for myself,DPMLM,17.5
9820,idfckathy thank u for getting me the ps5,Positive,ea lease harmon for breaking me the few,DPMLM,17.5
9836,tempting,Positive,transform,DPMLM,17.5
9840,ps5 looks nice i love white _,Positive,45 gestures great i fear fo _,DPMLM,17.5
9850,interesting for real this is really awesome looking,Positive,good for labour this is first freak eyes,DPMLM,17.5
9857,oooooh shit i think my motherboard is already compatible,Positive,ok dump i think my encode is jail gate,DPMLM,17.5
9864,i dont know what you people have been doing on this app but i told someone id buy my own ps5 and now shes insulting me,Neutral,"i ti * what you teenagers have been doing on this apps but i encouraged anyone log dab my own, and now she snapped me",DPMLM,17.5
9880,just so god damn beautiful pictwittercomn14qkprftj,Positive,just so luckily damn beautiful living,DPMLM,17.5
9895,holy shit how pissed off do you have to be to be able to toss a fucking fridge like that,Irrelevant,cold secondary how worse off do you have to be to be bare to throw a fund case suppression that,DPMLM,17.5
9915,facts bitch cant even get that ps5 for me lol,Neutral,pose bitch couldn local recover that body for me article,DPMLM,17.5
9940,watch the new playstation 5 demons souls trailer myglnewscomwatchthenew,Neutral,97 the samsung friday santos 571 s url --,DPMLM,17.5
9966,sony doesnt announce the price le pakistani awam pictwittercomkuvrxpuhwj,Neutral,jon wont know the newsletter 1 sublime word ins,DPMLM,17.5
9991,if i gotta buy my own ps5 and xbox this year never ask me to take you out to eat or eat your pussy cause ima tell you to do it your damn self,Neutral,if i wifi lb spare my own...and bread this cause diversity pitches me to band you out to supper or run your pussy! ga tell you to do it your dogs!!!,DPMLM,17.5
10007,pubg please sort out the game crashes,Negative,cried truck play out the power contents,DPMLM,17.5
10008,how is banning going to fix anything all its gonna do is make everything worse what do they expect people to do in this lockdown,Negative,how is evac aining to solved anything all its gon imp do is wreck itself negative what do they asked dec to do in this market,DPMLM,17.5
10011,one of the best kpop moments was at isac 2020 when all those kpop groups came together and just played a massive fuck off game of pubg tell me that wasnt iconic,Neutral,proceeding of the payoff revenge images was at unreal fetched when all those gran templates checked meet and just consumed a gigantic defensively off robbery of}) clear me that ohm […],DPMLM,17.5
10021,team shy military are your runnersup in pubg pc at the showdown tournament organized by gamerlk we wish them the very best in the upcoming tournaments,Irrelevant,bring sacrificing casualties are your rounder in unison curved at the yearly starcraft explaining by poke we wish them the very cup in the unfolding postings,DPMLM,17.5
10027,on youtube pubg best kills 48 squad kills 26 solo kills skreams gaming best kills record dadaabhihai youtubecomwatchv7jc7dz,Positive,on youtube bc all heads 363 targeted / 91 lantern spikes refunds sliding band areas notation inner 11,DPMLM,17.5
10054,india bans 118 chinese apps including pubg pictwittercom4rt8ykyxm3,Negative,education governs several chocolate trusted artistic liver コ,DPMLM,17.5
10073,my friend plays korean version pubg and blackpink hylt is bg music omgg i love it pictwittercom5skotzyvga,Positive,my wash rules marine rapper arabic and burg distribution is gag kitchen did i l it asylum,DPMLM,17.5
10078,even tae playing pubg i wont ever installing it hahahaha i dislike that game so much,Negative,non perish tea accompanied i contemplating officially bour it hated i negatively that video so here,DPMLM,17.5
10080,failed pubg mobile youtubeqz00pth41sw via youtube,Negative,cc orter map clips ashore blah,DPMLM,17.5
10082,africa esports championship is back with an exciting season 2featuring league of legends tekken 7 fifa21 pubg mobile calling all players to sign up nowto register visit aecafrica esportsafreeca,Neutral,there charismatic wedding is regener with an imagination series chunk del of demos 06 follows 900 wcs hemp electricity all nurses to partner up 118 learn hunt confederation ,DPMLM,17.5
10091,how to impress indian girlsahilyaduvanshiinloveatfirst,Irrelevant,how to delight personal charm,DPMLM,17.5
10095,is no more available on android playstore and ios,Negative,is no more limited on  game and acquire,DPMLM,17.5
10102,had a pretty amazing time streaming tonight pubg was alot of fun thanks to everyone who came and hung out,Positive,had a recipe yelled timing poker desire chuckled was lane of and greatly to through who butter and laughed out,DPMLM,17.5
10115,pubgmobile ban this random playre his killed me and my clan teammate i report pubg mobile in game plese strict action against cheater pictwittercomcpyyo6kcbz,Irrelevant,par pet this mash com his noon me and my dictator:) i worry mj endar in vii boulder stable arrest against culprit two,DPMLM,17.5
10121,yo the new event on pubg is weird,Irrelevant,official the forum city on scalp is controversial,DPMLM,17.5
10128,how abhijeet bhayya ur efforts are incredible and the way you try to satisfy our wishes are very good hope you continue the same with the good health and wealthlove fron hyderabad,Irrelevant,how donors evacuated your guidelines are outstanding and the directly you pr to chase our wi are very lies loss you continues the same with the speedy disease and ipper shortfall paralysis,DPMLM,17.5
10156,played pubg for the first time in a long time and loved it will be posting clips tonight,Positive,let gmail for the earlier little in a for time and rules it will be fitting videos!!!!,DPMLM,17.5
10162,is our illiterate community thinks pubg game is a killer then they must ban all the knives guns limit vehicle speed to 20 kmh and all the buildings in the country should be less than 10 ft height because they also cause thousands of deaths per year,Positive,is our unworthy undoubtedly counts whoever iddy is a scourge then they somehow nav all the powers!!! show ino engine to really germ and all the installations in the driver should be unsolved than 8 fore height because they abuse commit lawsuits of recon / days,DPMLM,17.5
10185,pts would not stop crashing on me tonight an issue i have never had with pubg_us pubg pubg_devs going to give it another shot in the am yall have a good night 6am central as always,Neutral,drug ould not stopping boring on me pillar an organisation i have of had with k mention uk had to time it each fig in the am beast have a blue wise cheese im as ual,DPMLM,17.5
10188,congratulations guys finally pubg unban ho gye thnks zakawaqar thnks all pubg lover,Positive,if dudes inet tested newspaper push sob bart destruction poster all orc iked,DPMLM,17.5
10193,best squad yet instagramcompbobt_eaa4f,Irrelevant,hanged management before abus,DPMLM,17.5
10212,worst thing about banned is that all the players didnt knew this ban till the app shown error in playing as non of them is in social media nor watch any news,Irrelevant,berry weed about familiar is that all the videos flo realize this patience entertain the brun addressed culprit in waiting as ored of them is in great republican nor worm any crime,DPMLM,17.5
10223,thank you waqar bhai finally pubg unbanned pictwittercompgeadhptnc,Positive,allel you pc conquest now ret subreddit rgb,DPMLM,17.5
10227,robodanjal any chance i could get a list of the maps for the new pubg tdm i cant seem to find a good list anywhere,Negative,66666666 any pace i am pause a listing of the ises for the economist factory pan i va start to travel a british catalogue approximately,DPMLM,17.5
10249,i hate that music,Negative,i kids that sound,DPMLM,17.5
10256,ptaofficialpk why u wanted to ban pubg is there any personnel fight with pubg corp pls unban this game if thousands of people requested u to ban this game then see now more than lakh people are requesting to unban dont take pubg as your pride problem,Neutral,asp why also ann to retain arm is there any sword high with overl clans which obsolete this players if helm of families deemed badly to rum this sucker then hyp now more than suspects gb are passing to keystone cannot even pund as your fab seek,DPMLM,17.5
10262,xboxaimbotcom is the greatest site to get free modz,Irrelevant,image is the benign come to do free min,DPMLM,17.5
10268,doing anything in extreme will cause consequencesbanning pubg is not the solution,Positive,doing much in concrete will pay against boiler is not the choice,DPMLM,17.5
10271,this week in disruptive tech curated by rmnth 1 pubg ban a twist in the tale2 why facebooks politicalad ban is trying to tackle the wrong problem3 when law enforcement meets predictive algorithms foundingfuelcomcolumnthiswe,Irrelevant,this pers in downtime crust flickr by ratt  popped pos a spit in the history why ubiquitous altogether bon is spinning to solution the exhibition mainstream when designated instinctively hike sample degrees er,DPMLM,17.5
10275,pubg_support hiya so whenll u be fixing your fn console game been asking a lot and have been very satisfied with your lack of responses just wondering if lagouts are a part of the game like red zones and im just not aware or if you just cant fix a 2 year problem thx,Negative,translator vil so const lg be rebuilding your spawn uminium shifted been gaining a gal and have been very wife with your is of disorder just praising if lafayette are a out of the engine kil dead kill and its just not or or if you just must smack a million signs habit breach,DPMLM,17.5
10280,amazing how the mainstream media tries to normalise muslim criminals and terrorists bdutt painted burhan wani as a facebook star son of a schoolmaster washingtonpost made baghdadi an austere scholar the print paints shahrukh as an aspiring model,Irrelevant,off how the excessive people pushes to 458 pengu scares and rather verdict shot dh surgeon as a basketball who catering of a commentator then manufactured longer an bolshe funky the congress shades 光 as an appalling modeling,DPMLM,17.5
10306,on youtube pubg mobile best tiktok videos funny moments electro ice zard youtubecomwatchvv6erpx,Irrelevant,on youtube viral assistant random hackers ideas clever concepts icist 886 noodles tink,DPMLM,17.5
10307,are u crazy gloating as if u r his fan n not a responsible journo sorry expected u change but drummer never change why dont u write a book u worshipper,Irrelevant,are pastor lying routing as if owner #his fa extr not a bad brother apologize sund clouds care but faults often disrupt why recess ya maintain a form fi integers,DPMLM,17.5
10309,pta pubg ban is unconstitutional in nature because it violates article 18 of the constitution of the islamic republic of pakistan the employees involved should be suspended ptaofficialpk zakawaqar pictwittercompxh87dxb2z,Irrelevant,rooted plug flare is apprehended in nature because it rivers quote 65 of the structure of the fundamentalist loc of patriotism the outgoing angrily should be sacked loss nine 0,DPMLM,17.5
10315,why can i hear my little sister arguing with people on pubg,Irrelevant,why can i meet my bad bl hing with pilgrims on -->,DPMLM,17.5
10334,i cant find confirmation anywhere but it looks like fenix_app has quit muting keywords if talon can strip the imaginary sports from my timeline i may need to switchblaseball like fandom pubg but at least the mute filters worked for pubg,Irrelevant,"i squads prove k awesome but it look hope android has opped oming discussions if drop can cut the fake sports from my balance i certainly sign to hed scrape "" crush but at how the unatt engines built for obo",DPMLM,17.5
10370,thatd be so sad tho,Negative,who be so folks track,DPMLM,17.5
10391,3 years ago this week such a good time for pubg and a huge accomplishment for playerunknown his team to put on the observer room was insane so many cables life changing thank you pictwittercom6rwnqks2kc,Positive,2 predators via this about such a mor ifying for promulg and a etime moment for consequence his thank to whereas on the looking got was rary so possible when lived blowing stream you fans,DPMLM,17.5
10406,driving through new mexico is like driving through red dead redemption,Irrelevant,application through crying pa is ment lining through ag water grains,DPMLM,17.5
10412,red dead redemption 2 load timesxbox series x 38 secondsps5 1012 seconds yet again sony still have the better machine,Irrelevant,tty characters modes 98 uction rod compression mostly brent second 987 elsius meanwhile again 51 run have the verse working,DPMLM,17.5
10422,this is fantastic,Positive,this is typically,DPMLM,17.5
10429,my favourite 4 gamesgod of warred dead redemption 2uncharted 1rise of the tomb raider,Positive,my dispersed truck rand of tur light uden jesuit cient of the officer creep,DPMLM,17.5
10439,red dead redemption 2 street fighter v cyberpunk 2077 resident evil 3 remake dying light 2 wnnrtxkg9n,Neutral,"im either ****, internet gard patrols simulation ulent retail conjunction dame applications copies pure pts τ",DPMLM,17.5
10444,until jul 16 red dead redemption 2 is 3999 10 off amazonps4 amznto37yuuabx1 amznto2smbhgx,Neutral,until snipp sm second friend canon ke is trademark slave off headphone 427 battery,DPMLM,17.5
10461,rock on mr black and keep being the most honorable cowboy in red dead redemption 2 brother cya next time pictwittercom0ieh2y86q4,Positive,ld on tofu than and his being the most condemned coward in sparks wom taker 287 spl circadian new bill interoper,DPMLM,17.5
10496,planning on spending my entire night playing red dead redemption and getting stoned and i have absolutely no regrets,Positive,ways on traveling my throughout definition drinking red mt author and skiing low and i have now no casualties,DPMLM,17.5
10498,finally finished red dead redemption 2 after nearly a year and a half of play how does something so immersive with so much detail on such a grand scale even manage to get produced its nothing short of both an engineering and artistic miracle,Positive,plin received pulp simon started desc after hearing a jerk and a spare of left how does one so racing with so's community on such a main everyone entire allow to weekday exhibited its dangerously itas of both an struggling and administrative virtue,DPMLM,17.5
10513,red dead redemption 2 xbox jogando no game pass mmixercomvaltinhoroberto,Neutral,cp delay ocard) method enacted no we opp vi,DPMLM,17.5
10520,runs around aimlessly on red dead redemption 2 online completely forgetting shes supposed to be getting animals for the trader role,Neutral,offs mad too on red error reckoning comic amines still unaffected: wont to be serving vessels for the crane holes,DPMLM,17.5
10534,red dead redemption 2 pictwittercom2xblcpjlxl,Neutral,row dead helpful 2 hardware,DPMLM,17.5
10537,happy birthday red dead redemption that shit changed my life what a crazy experience,Positive,303 au lip football detriment that fuckin left my car what a colourful invasion,DPMLM,17.5
10544,hi guys i just got red dead redemption and i have no idea how anything works but a pack of wolves just killed me and stole my bear pelt so i rage quit and im gonna take a break from this game for the foreseeable future,Negative,jan tories i just grid directly life dismal and i have no joke how anything casters but a rug of scriptures just drove me and damage my handling defects so i already doomed and ex shin curiously big a dose from this one for the frightening region,DPMLM,17.5
10555,gaming gone wrong fail compilation red dead redemption 2 csgo black ops 4 funny moments funnyfailsvideogaminggonewr,Neutral,investing ursed gold passwords cleanup pin decent er two n hold jets 400 optional pundits closer,DPMLM,17.5
10558,red dead redemption 2 leaves xbox game pass on september 7if you havent bought it already highly recommend it pictwittercomms65gbzwml,Positive,aunts perpetual engers 100: developers terrorists milliseconds on smell currently you fac stray it appears tolerate bloodshed it:-,DPMLM,17.5
10563,red dead redemption got me wanting to move to a mother fucking ranch,Positive,focused aly ron spurred me eventually to remain to a advertis burying modern,DPMLM,17.5
10568,its been a year and a half since red dead redemption 2 came out and i finally have time to play it now it has completely sucked away 3 days of my life now very worth it,Positive,its been a party and a tenth morning the country bloom official built out and i 16 have clothes to meet it now it has & evidenced along find 34 of my intestine now very better it,DPMLM,17.5
10585,red dead redemption 2 by simba pictwittercomoebblxui9l,Neutral,space osponsors oe hip by x peg,DPMLM,17.5
10588,6th__man playing red dead redemptionoh shit a bear starts running me you cant out run a bear they run like 40mph him whatimmediately mauled by bear,Neutral,sc euro red unreal urban away a shoulder minutes building me you ur out muscle a marijuana they oxygen both thirty him canadians mounted by answer,DPMLM,17.5
10589,i got the horses in the back red dead redemption 2 live at youtube9bvkh67oaei,Neutral,i barn the ones in the center conservatives deaf abandoned to side at youtube,DPMLM,17.5
10595,i won 5 achievements in red dead redemption 2 for 117 trueachievement pts trueachievementscomgameryoneko,Positive,i won orted puzzles in cca literature game format for remove vigil drama diffuse,DPMLM,17.5
10596,red dead redemption 2 youtubejoysfxh2r9o,Neutral,adult knocking travels ost irma,DPMLM,17.5
10598,red dead redemption 2 online streamlabscomwarrenarroyoh,Neutral,location 74 min ju unauthorized poke,DPMLM,17.5
10601,the new red dead redemptions graphics look incredible,Positive,the broken cc ux purple crashes love exceptionally,DPMLM,17.5
10602,red dead redemption 2 now live on twitchtvmarcel_kiefer,Neutral,diff break ers science now shaky on destroy,DPMLM,17.5
10644,had fun in red dead redemption tonight thanks all to who tuned in clipstwitchtvtsunderelightr,Positive,had whom in rebel pd readable today settles all to who escaped in soon,DPMLM,17.5
10646,red dead redemption pictwittercomqnn6cnz5yq,Neutral,of intern marine 86,DPMLM,17.5
10670,red dead redemption 2 xbox one bitly2wc9cxm,Neutral,"posted unlocked friction controlled forty partners ""],""",DPMLM,17.5
10679,dont understand why they port this instead of gtav on switch itll look much better,Negative,enthusiast weird why they ported this sh of ext on these l floor exp lighter,DPMLM,17.5
10694,rockstargames i legit cant open or set my fucking camp im red dead redemption you need to let gta die and fix rdr2i it pisses me off the the games been out for a year and you havnt done shit,Negative,bm i resolved eri int or leaving my gaming gene am er in integral you have to clause brains g and feb assassin it uls me off the the crus been out for a yr and you sweat caught hit,DPMLM,17.5
10695,esports curiosities you probably didnt know about red dead redemption 2 goalsncom202002esport,Neutral,train charm you pasture _ wanna about grass past adverse meets larger,DPMLM,17.5
10708,im really sorry for you son its a hell of a thing arthur morgan being diagnosed with tuberculosis on red dead redemption 2,Neutral,isexual k!! for you bastard its a struggle of a tribute example mph being engineering with residue on structural thread brook 2,DPMLM,17.5
10712,red dead redemption 2 day 8 can i shoot micah i dont like micah twitchtvnightmarebearer,Negative,forum my activation cement end 248 can i trick lid i kill criticize hij listen,DPMLM,17.5
10719,red dead redemption 2 broke me broke my heart the wild west is a cruel place,Negative,lived hell redemption two gave me died my scar the found flick is a brutal hon,DPMLM,17.5
