id,text,sentiment,obfuscatedText,mechanism,epsilon
5731,jimbcbs4 hey jim we disagree on politics and policies but the greeter that cussed you at home depot was so out of line im so sorry that others have made you deal with that,Neutral,serve hey admiral we mk on battles and communications but the p that boasted you at south mism was so out of not hype so fat that they have looked you finnish with that,DPMLM,17.5
5756,while this article says marcus no longer ran the company that is home depot he still makes the in stock so go ahead and boycott,Negative,while this entry dumps the no signed nor the player that is yard labour he again works the in mystery so take through and crime,DPMLM,17.5
5818,some milestones and anniversaries here at the chicopee home depot congratulations ed to 29 years with the company and gaining another gold milestone tim to 14 years with the company and mark for gaining another silver milestone time does fly by when youre having fun pictwittercomdilaa5cufx,Positive,some carriers and experiences here at the govern news hub grief junior to 14 depicted with the saying and thus father gold premium extend to 40 days with the kimberly and irms for prior new them significance er does langu by when yrus having history ...,DPMLM,17.5
5832,worked at macys worked at chick fila worked at home depot which one is the lie,Neutral,noticed at promoted checked at shar subject volunteer at down nowhere which validity is the accommodation,DPMLM,17.5
5861,this pic is so cute why,Irrelevant,this spe is so ok why,DPMLM,17.5
5865,homedepot this has been the worst experience weve ever had with home depot in wentzville we spent 76330 on a bad ass machine with a great 5 year warrenty only to wait for 1 week for it to be dropped off then it doesnt even work nothing can be done until the 28th,Negative,onds this has been the angry tale etc emotionally had with cat legions in anything we got 690 on a dope relapse concern with a fault thrilling kay pharm only to hurry for another kg for it to be invited off then it tickets water smell little can be blamed until the customer,DPMLM,17.5
5888,instead of using suitcases for moving to uni and having to find a place to put them in buying boxes from home depot and then recycling them i think im a genius,Neutral,years of painting examinations for returning to c and having to only a path to things them in inviting programmes from homes cassette and then cloning them i on j a billionaire,DPMLM,17.5
5921,ups 2 bad she was not n place wen ups cust reps decided 2oss my 1600 last nov 2019 wen ur reps wont do something 2 a oid disaster ur rand integrity s called n2 question trust means a lot 2 mo ths disability benefit,Irrelevant,t thr special she was not now ername sew su in scouts esthetic ultan my ammad fisher expansion cho launch any machines 53 do something such a? ising mr vag money s stretched ect gently frost implying a explained two ko flashing staffing balance,DPMLM,17.5
5965,as much as i dont like the amazon business model nobody going to tell me to wear an ineffective cloth mask so homedepot cvspharmacy walmart samsclub target just lost all my business to amazon this lunacy is out of control realdonaldtrump censoredcinder breitbartnews,Positive,as much as i mist president the same pleaded basis 233 goes to appeal me to apply an applicable cloth classmate so press racism lull awful countries just transferred all my room to netflix this warehouse is out of legislative awesome zombie statement,DPMLM,17.5
5984,dbongino and real quickly as i have to run to home depot and touch everything with my rubber gloves of course but 7 days ago they predicted in the us up to 2 million deaths do to covit19 3 days after that they said 100 to 200 thousand and a rate of death at less than 2,Neutral,"quick and res briefly as i have to dissect to homes checkout and reset isolate with my rss amenities of course but simple wants notice they stat in the trin up to any, galaxies do to fi 6 credits after that they ed 275 to double bucks and a atted of merged at - than comm",DPMLM,17.5
5987,homedepot your customer service is atrocious ridgidpower ridgidtoday impact driver not fixed after 3 weeks being given the run around on lsa service agreement even w documentation in hand,Negative,december your approval expectation is dreadful this nice virus set not due after md long being mf the opt 000 on mailing function essentially establish gets documentation in inf,DPMLM,17.5
5999,i used to work at home depot and all i can say is that their security cant touch u or make u give them the merchandise and most of the younger employees dont care if ur slick enough,Negative,i quote to suck at art delivery and all i can part is that their ship battles it su or pa occ lend them the demo and most of the culprit ee or pose if ver primates.,DPMLM,17.5
6019,switzerland opens criminal case against fifa boss infantino scoopliveorgswitzerlandop,Negative,"video agrees municipal option against nepal composer brazil.""",DPMLM,17.5
6022,more fifa leslie steiger must be joking see the horrible thing here ifttt2y1tbto,Negative,more ping jess threshold tastes be already perception the tasty spaceship here if,DPMLM,17.5
6029,fifa 20 is the worst fifa of all time,Negative,una flavored is the poor speed of all months,DPMLM,17.5
6038,ea bans prominent fifa streamer kurt0411 from all its games over toxic behaviour tinyurlcomyxyvwh2q,Irrelevant,pa sacks famed aina inference iconic from all its zones over warrior financing beams,DPMLM,17.5
6055,former arsenal and west ham player alex song has taken his case to fifa after being sacked by fc sionthe 32yearold was one of nine players to lose his job when the swiss side proposed reducing the wage bill of the first team as an emergency measure during the coronavirus,Irrelevant,professional i and resemb midrange cth reading techno has and his towel to honorary after being positions by la antar cooler was copyright of friday dimensions to prolong his own when the signal ize staged cooling the damp work of the record theme as an arcade sociology during the game,DPMLM,17.5
6056,the nigeria national team has been ranked as the 29th best team in the world and 3rd in africa in the latest fifa world rankings its the first time the team has made the top 30 since may 2013 kano nigeria instagramcompcfpzvton8ab,Irrelevant,the authentic defunct confidence has been while as the duck overall stre in the dred and marched in africans in the guitars africa ellect quotas its the upcoming lenin the official has broken the remission rated but trek 1995 especially africa mainly,DPMLM,17.5
6086,amazing how toxic the fifa community is in august congrats easportsfifa for creating one of the most toxic communitiesright up there with csgo and rb6,Negative,just how shitty the ь code is in exponential pd context for mixing 1 of the most plummet companies up there with bursting and roman,DPMLM,17.5
6091,so was playing fifa today,Neutral,so was researching russia effectiveness,DPMLM,17.5
6098,no fucking thank you,Negative,no bouncing winston you,DPMLM,17.5
6102,super eagles move up four places in february fifa rankings best9jamusiccomngsportssupere,Irrelevant,2000 between moving up manifest r in donation fif orous hit,DPMLM,17.5
6109,oh yeah happy fifa 21 day everyone,Positive,izer but grass disobedience march m looking,DPMLM,17.5
6137,sick of sidemen stans oh you mean the people who called you out on your bullshit when you were too fucking lazy to post important petitions and to speak up and spread awareness for an important movement but you had the time to post about fucking fifa and acted as if you,Negative,demo of ain ones thru you guys the sunshine who cancelled you out on your tricks when you were too bloody well to gift public documents and to sen up and joke exhibits for an ongoing motion but you had the disgrace to op about bloody dim and pretended as if you,DPMLM,17.5
6143,not gonna lie the fifa 2021 and ps5 combo is sounding really nice right now,Positive,not too li '. the ncaa bull and cannabin theoretical is assembling...jerk t now,DPMLM,17.5
6164,in l6 mi remember when the two man dem did a fight over a fifa matchto be honest it was more of a personal disrespect than the actual gamebut still,Irrelevant,in envy mi sterile when the answer airstrikes em did a beef over a damn true be sure it was more of a museum patriotism than the entire assault ...,DPMLM,17.5
6185,bashing fifa for no reason you all are proving how insecure you hate lingers are from shehnaaz and her popularity just because fifa supports shehnaaz and sidnaaz ohh myy gawwwd,Negative,804 prosecutors for no dent you all are transmitting how suppress you econom talent are from us and her colonies just because may destroys trump and assail h may bds,DPMLM,17.5
6187,fifa 20 is honestly the biggest pile of shit excuse for a game ever created the game is played at 2 miles an hour slow clap for ea,Negative,a temporary is properly the tallest cloud of insanity claim for a base openly purportedly the individual is shot at gw motions an patient slow usage for institution,DPMLM,17.5
6194,when pro clubs fucks up the kits,Negative,when democrat blow tremendous up the phi,DPMLM,17.5
6218,playing fifa with my girl she got her first goal against me and someone wont shut up,Neutral,in cycl with my age she came her waged relieve against me and perspective'll spray up,DPMLM,17.5
6219,you are not reading this by mistake i can beat you in fifa,Irrelevant,you are not det this by defamation i can conquer you in compromised,DPMLM,17.5
6224,delighted to see fifa supporting the who in the fight against covid19 they want to pass the message to kick out coronavirus youtubeztl5ajdb48,Positive,pots to credit 2003 leaving the who in the match against alliance they give to damage the test to collapse out mech claimed,DPMLM,17.5
6258,fifa 21 soars to the top of the charts this week with 36 million players already ingame in the first 24 hours nintendo takes five spots in the top 10 and star wars squadrons holds on to number 2 for the second week in a row bitly3jmuwq2,Positive,sever yre heats to the horizon of the websites this caribbean with 49 mn systems necessarily thank in the second 235 weeks pyramid clouds 148 stays in the verdict 90 and ear boy 07 trades on to% s for the division usb in a loop ata,DPMLM,17.5
6267,pissing people off in fifa and on twitter,Negative,lux fishermen off in umar and on aol,DPMLM,17.5
6272,why does nobody want to sign for my fgrfc_official fifa 20 side im livid messi being a pure uppity cunt,Negative,"why does anybody' to write for my official paycheck 2010 nsw sem 0 sandwich being a "" freak 729",DPMLM,17.5
6273,hi eahelp ive had madeleine mccann in my cellar for the past 13 years and the little sneaky thing just escaped whilst i was loading up some fifa points she took my card and im having to use my paypal account but it isnt working can you help me resolve it please,Negative,ortality uniforms ively had durable picture in my rent for the hair 265 followers and the ending dangerous — just or cv i was landing up some 5 bret she kind my app and every having to populate my assistance tain but it inder shooting can you art me desktop it 71,DPMLM,17.5
6280,futs menu stuff this year is the best it has ever been by far you can easily make coins and build a fantastic team without spending a peny brillianthowever the gameplay how scripted it is and ai dominant it is along with the awful servers ea have make it unbearable,Neutral,itor click stuff this by is the advance it has year been by creepy you can strikingly swap beverages and kill a fine show nor tackling a cartridge difference the sh how gary it is and deploy constant it is beyond with the nightmare segment may have production it ridiculous,DPMLM,17.5
6291,five african matches you would love to see from fifa googlehitscomworldcupathome,Positive,2018 ato arrests you bri care to see from snug gandhi,DPMLM,17.5
6297,we may not be able to stream today you lot we have a problem xbox is not letting me stream fifa 21 and its so annoying ill try and find ways arround it and might still be able to stream but if not ill keep you updated on when ill be live again,Irrelevant,we vere not be remembered to repe jewel you regulars we have a bank prohibit is not cooling me stream heaven courthouse and its so pat: lo and easy strides lap it and might possible be theirs to stream but if not enough field you worked on when cos be there again,DPMLM,17.5
6303,how did i miss this i cant even blame school are you kidding me,Irrelevant,how did i slaves this i doubt 348 guess homework are you proving me,DPMLM,17.5
6323,fifa 20 gets me angry,Negative,atana 27 spells me?,DPMLM,17.5
6338,chaplinez70 morning you might not agree with me and i mean no disrespect to anyone but i feel having an international break during this pandemic is a terrible idea i dont understand what the guys at fifa are thinking but its just not right,Negative,great freak you though not belong with me and i eat no insult to alcohol but i pra having an escapes ilts during this ş is a heinous) i no get what the cool at caldwell are executing but its just not styl,DPMLM,17.5
6339,damn,Negative,sac,DPMLM,17.5
6340,one game of fifa tonight and im done pressing lb to change player and its taking literally 3 seconds to do it same with passing and changing direction sham of a game,Negative,usal ue of convert earchers and im completed sets bindings to shift qb and its destroying celsius c february to do it same with warning and taking ball om of a game,DPMLM,17.5
6345,wendie renard loses fifa trophy on a train and appeals for its return dlvritrmnwq2,Positive,ennis keeper hits a fielder on a grass and advocates for its payment licensed,DPMLM,17.5
6353,this was easily the best fifa first time with secondary divisions off the ball control free kick spin and placement and an original soundtrack to vibe to unmatched pictwittercomlmzxeagopr,Positive,this was absolutely the superstar attendants bass only with heavy stripes off the pil fit everyone outcome rict and neither and an animated hardware to madonna to enough uniform,DPMLM,17.5
6356,shame weemanronza had to get me in the first round of the fifa tournament this week by all accounts a nice guy and a good player but theres no gettin by the bud,Irrelevant,@ bal had to guy me in the musical #of the euro forming this go by all amounts a kind pup and a tears tv but warned no swinging by the biol,DPMLM,17.5
6361,man fifa 19 was my game despite how shit it was shame i cant play fifa 20 so i can wanna rip my brains out again,Neutral,porary nu sons was my drug ti how shitty it was pas i disbel sp ka 2 so i can sama condoms phillips my instincts out again,DPMLM,17.5
6376,we are pleased to announce the names of the referees approved by the fifa referees committee for the 2020 international listsbondo joshuagobagoba tshepo mokanimositwane tirelodintwa keabetswemethikga itumeleng women referee pictwittercomiohpfxl5tp,Irrelevant,we are thrilled to give the strokes of the 395 armed by the association commissioners stroke for the 2017 official insensitive camera wo georgia worldwide ni archaic pv maurice lys,DPMLM,17.5
6379,thank you for wanting me to stay home and play some of fifaeasportsfifa eahelp pictwittercom7vw03aflay,Positive,fuck you for stretching me to bounce myself and kill some of lan terrible 356,DPMLM,17.5
6404,whoisaddison i made a fortnite montage for you,Irrelevant,buck i!!!! a recent roadmap for you,DPMLM,17.5
6407,it is absolutely ridiculous that prop hunt is not in fortnite anymore the utter disappointment smhjakestatefarm fortnitegame kimkardashian,Negative,it is intensely acky that gang 36 is not in props bren the profound embarrassment laughter game 1889,DPMLM,17.5
6408,see i can get behind it when you explain ya self controller is only broken when you have it with a pc that makes complete sense thank you ninja for actually explaining it and not being a fucking retard like everybody else,Irrelevant,money i can perfect even it when you assert attendant growth grip is only destroyed when you have it with a ahl that tire total paper mid you clan for quietly iq it and not being a .... stupid he other thats,DPMLM,17.5
6431,epicgamestr fortnitegame my save the world glithced our and i didnt get my 300 vbucks from save the world for daily log in i pressed claim it worked but they are not showing up,Negative,rums oyle my pass the downstairs las our and i cant own my hundred adv from revision the ington for ana those in i didnt token it listened but they are not sitting up,DPMLM,17.5
6437,funny did laugh thank you blue fortnite man,Positive,winter did laughing den you friends laughed suffering,DPMLM,17.5
6466,just beat my kill record in team rumble pictwittercomhlnhedkufo,Irrelevant,just olds my nerve most in baseball protections occurs,DPMLM,17.5
6472,formula yo alix or formula i am a big fan and it will mean a lot to be in a vid my fortnite username is freshed1ts pls add me,Irrelevant,om yo apples or src i am a semester helpful and it will stand a starting to be in a responsibly my 997 contents is style printed allow me,DPMLM,17.5
6494,looking at pc specs yeah this will run fortnite at 60 fpsbitch i dont care for or play fortnite,Negative,par at laptop appy little this will play line at 55 304 i never yarn for or godd maj,DPMLM,17.5
6496,dusty depot,Neutral,clean pant,DPMLM,17.5
6509,just dont know why fortnitegame doesnt seem to care about asia servers the mostthey care for every single server region yet not asiappl from south east asia are having such bad pingfighting japanese with 0 ping while epic just fucks with this new,Negative,just know check why ctrl basically ch to service about end standards the double friendship for everyday drawn gas except reveal not legal from nutshell lord cert are having such enough hate lightsaber with any compliment while elections just fares with this retreated,DPMLM,17.5
6540,happy birthday fortnite,Positive,98 stripes sarcastic,DPMLM,17.5
6560,back at the og memes i love the sky base follow me every day cyper for everyday content,Irrelevant,dm at the pit atten i jazz the culture acupuncture fish me entire tense � for hourly glory,DPMLM,17.5
6569,i havent watched the nba in quiet some time ive actually boycotted it most of the year because of the hong kong fiasco but dame_lillard may just bring me back its like he is on a fortnite heater,Irrelevant,i ighed watch the told in inf some time o uber banned it most of the floor because of the outrageous senseless beg but balanced'll just bring me lect its get he is on a pirate hitter,DPMLM,17.5
6583,this skin didnt age well localpolarbear,Negative,this dying should decline fairly stripped,DPMLM,17.5
6586,10 year olds trading on the stock market is scary news it can instill good financial habitscuriosity but equally high chances of it going the opposite way seeding gambling tendencies heavy losses from trading fos or worse this becoming the next blue whale not worth it,Irrelevant,89 y olds battling on the linked show is alarming ume it can encourage improved outdoor combinations but distinctly tense scenarios of it driving the echo entry dawn tennis deduction uted deliveries from harming engines or well this creating the doors neon choice not numer it,DPMLM,17.5
6593,by far my best stream without a raid we were hovering around 1215 viewers for about an hour and gained a boat load of follows much love pictwittercomontb94ufaj,Irrelevant,by pa my fin catalogue straight a sc we were cc heterosexual folder skulls for about an hourly and regain a village medicine of musicians money news walters,DPMLM,17.5
6610,fortnitegame making the storm water was the most retarded thing anyone could come up with smfh its like yall wanna ruin ur own game,Negative,ty changing the surging better was the most peculiar process any jewish strike up with because its s & wont nab berkeley shrine own show,DPMLM,17.5
6617,fortnite is bullying me arent theyi need him pictwittercom3q3yxuxkfy,Negative,statement is big me where yo sen him flake,DPMLM,17.5
6619,lets stop using good popular songs for shitty fortnite montages please its just a disgrace to the song,Irrelevant,w pit hitting rich soul compositions for fun firefly maps try its just a flashback to the mcdonald,DPMLM,17.5
6640,my advice when you suck like me vmtiktokcomzmjfqkrpy,Irrelevant,"my "", when you hi l me oh",DPMLM,17.5
6646,all the 14 yos shitting on me in fortnite catch me irl i swear ill rock yo shit,Irrelevant,all the caribbean meanwhile loos on me in committing restless me tal i start ll mess ye hope,DPMLM,17.5
6650,fortnite is running like ass fps drops everywhere wtf,Negative,199 is picking fake surprisingly just ticks though effic,DPMLM,17.5
6658,a man on top for that fortnite song,Irrelevant,a mind on cock for that bravery sap,DPMLM,17.5
6675,roundedtiktak thank you pictwittercomzwqorfk0jn,Irrelevant,auto fictional you branch,DPMLM,17.5
6687,unpopular opinion fortnite is kind of the best game ive ever played its almost like it was thought up by a person who lives alone,Positive,column rient uggle is tame of the acad slice  exchanged conducted its ultimately mental it was planted up by a user who drinks um,DPMLM,17.5
6694,not free to use recent work pictwittercomp9vmutkt49,Negative,not admin to drive native help explained,DPMLM,17.5
6715,fortnite has these bots that make the game unplayed lmfao literally unplayable because of course you land with just an axe and before you can loot a bot with weapons already on the ground just shoots you before you can even arm yourself lmfao fortnite right now is a waste of data,Negative,pir has these as that leave the room machines corona properly far because of great you ultural with just an picking and before you can user a nor with ps regularly on the delaying just stereotypes you before you can technically closest yourself cf sample 01 now is a wast of data,DPMLM,17.5
6718,fuck fortnite yes i rage quit,Negative,419 organization lawn i meme ped,DPMLM,17.5
6725,this guy is fucking cracked holeeee,Irrelevant,this actor is ridiculously crack hot,DPMLM,17.5
6750,rue its so beautiful pictwittercomorquudxmvj,Positive,profile its so terrible read,DPMLM,17.5
6772,fuck i missed this,Positive,sorry i practiced this,DPMLM,17.5
6773,what the actual heck fortnite you clearly have enough money but you dick wds just dont learn the mistake thanks for ruining my weekend,Negative,what the occur rank wil you really have contention lumber but you automatically bothers just ant tempt the inges comment for stopping my magically,DPMLM,17.5
6787,dumb lucky fortnite montage youtubepswjtnkbqbe via youtube,Irrelevant,she some prepaid catastrophe corner 97 beta,DPMLM,17.5
6795,hi fortnitegame i get that you wont remove sbmm in pub games thats okay but why the fuck do you insist on putting absolute shitters on my team wtf,Negative,ario oc i'm that you refuse robot excess in truce shooters treason holl but why the litter do you system on stacking little steroids on my team nud,DPMLM,17.5
6806,johnson johnson stopped their trial because a participant got an unexplained illness the ft tweet needs commas jnjnews,Neutral,643 guitar derive their embryo because a marker bi an independent condesc the redundant complainant shootings blockers ups,DPMLM,17.5
6826,johnson johnson stops selling talcbased baby powder in us and canada standasideusjohnsonjohnso,Neutral,squeezed chicago et eling convenient ss attendance in we and colombia is,DPMLM,17.5
6838,washington us pharmaceutical company johnson johnson said monday it had paused its covid19 vaccine trial because one of its participants had become sickwe tamilnaduchroniclecomjohnsonjohnso,Neutral,irk pigs molecule sober predecessor sadness situation two it had suspended its taxed ns probe because narration of its aides had receive adier what,DPMLM,17.5
6850,a san diego superior court judge ordered johnson johnson to pay 34399 million for hiding the dangers and risks of its surgical mesh product for women onnbc7comzll0biq,Neutral,a rail die incurred common review update ni vegetable to apply ubiqu unintentional for sh the spills and rices of its network omni component for backers o,DPMLM,17.5
6851,skunkworks at johnson johnson is rushing to develop a coronavirus vaccine inquirercombusinessdrugs via phillyinquirer,Neutral,working at johnston good is pressing to mentor a dreadful we nazis lift id,DPMLM,17.5
6853,adrian thomas the vice president of the scandalridden medical and pharmaceutical giant johnson johnson rounded off the group thomas is responsible for pandemic care at jj including the development of vaccines against ebola dengue and hiv and there was also martin,Neutral,ira roadside the phrase credit of the large dimensions and alk giant richardson odor partisans off the threat as is cellular for savior report at kelly flooding the deliveries of vmware against blocked fury and fever and there was oh rik,DPMLM,17.5
6854,coronavirus vaccine race gets desperate johnson johnson posts losses cases spike websfavouritescomscienceandte,Neutral,nar prediction vm hassle overlooked son instrument waters 17 trunk mg uality,DPMLM,17.5
6860,that johnson johnson leave in conditioner works good asf it really defined my babys hair,Positive,that pronoun otto biting in environmental worked soup neau it have disguised my peoples og,DPMLM,17.5
6877,with johnson johnson baby powder still being available in some markets we want to alert you of the damages that these talcbased products may cause learn more about jjs lawsuit bitly3gnsdna,Negative,with odka birthplace concert litter batting being prior in some dealing we seem to archive you of the jurors that these amas subsidies health...harvested more about solar defense 46,DPMLM,17.5
